institution,period,euro,doi,is_hybrid,publisher,journal_full_title,issn,issn_print,issn_electronic,url,colour charge,cover charge,page charge,permission,reprint,submission fee,payment fee,translation,fast track fee
hh,2024,2212.26,10.1109/TPAMI.2024.3357847,True, Institute of Electrical & Electronics Engineers (IEEE),IEEE TRANSACTIONS ON PATTERN ANALYSIS AND MACHINE INTELLIGENCE,,"0162-8828,",1939-3539,,,,,,,,,,
hh,2024,279.03,10.36315/2024v2end066,False,InScience Press,Education and New Developments,,2184-044X,2184-1489,,,,,,,,,,
hh,2024,1788.92,10.2196/52744,False,JMIR Publications Inc.,JMIR Research Protocols,,1929-0748,,,,,,,,,,,
hh,2024,1918.91,10.3390/children11060636,False,MDPI AG,Children,,,227-9067,,,,,,,,,,
hh,2024,2110.88,10.1109/TNNLS.2024.3415149,True,Institute of Electrical & Electronics Engineers (IEEE),IEEE Transactions on Neural Networks and Learning Systems,,2162-237X,2162-2388,,,,756.47,,,,,,
hh,2024,2200.16,10.3390/jcm13133918,False,MDPI AG,Journal of Clinical Medicine,,2077-0383,,,,,,,,,,298.1,
hh,2024,3107.4,10.1037/spy0000368,True,APA,"Sport, Exercise, and Performance Psychology,",,2157-3905,2157-3913,,,,,,,,,,
