"","","1531.2","USD","","","2014-06-11","","University of Glasgow","APL Materials","","","","AIP Publishing","2014","","0","","THE ATOMIC STRUCTURE AND CHEMISTRY OF FE-RICH STEPS ON ANTIPHASE BOUNDARIES IN TI-DOPED BI0.9ND0.15FEO3","10.1063/1.4884684","1.0"
"","","2144.57","EUR","","","2014-06-11","","University of Glasgow","Current Microbiology","","","","Springer Nature","2014","","0","","Optically trapped bacteria pairs reveal discrete motile response to control aggregation upon cell-cell approach","10.1007/s00284-014-0641-5","0.990990990990991"
"","","2040","","","","2014-06-16","","University of Glasgow","Journal of Micromechanics and Microengineering","","","","IOP Publishing","2014","","0","","Injection moulding of ultra high aspect ratio nanostructures using coated polymer tooling","10.1088/0960-1317/24/7/075019","1.0"
"","","1523.45","EUR","","","2014-06-16","","University of Glasgow","NIMA Proceedings","","","","Elsevier BV","2014","","0","","Development of planar pixel modules for the ATLAS high luminosity LHC tracker upgrade","10.1016/j.nima.2014.06.046","1.0"
"","","976.87","","","","2014-06-16","","University of Glasgow","IEEE Transactions on Electron Devices","","","","Institute of Electrical and Electronics Engineers (IEEE)","2014","","0","","Co-fabrication of Planar Gunn Diode and HEMT on InP Substrate","10.1109/ted.2014.2331368","0.9917355371900827"
"","","1500","","","","2014-06-16","","University of Glasgow","International Journal of Stroke","","","","Wiley-Blackwell","2014","","0","","Detection of ischemic penumbra using combined perfusion and T2* oxygen challenge imaging","10.1111/ijs.12327","1.0"
"","","1620","","","","2014-06-16","","University of Glasgow","BMJ Open ","","","","BMJ","2014","","0","","European Working Time Directive and doctors' health. A Systematic review of the available epidemiological evidence","10.1136/bmjopen-2014-004916","0.9912280701754386"
"","","2159.95","EUR","","","2014-06-20","","University of Glasgow","Marine Biology","","","","Springer Nature","2014","","0","","Inter- and intra-year variation in foraging areas of breeding kittiwakes (Rissa tridactyla)'","10.1007/s00227-014-2477-8","0.994535519125683"
"","","2040","","","","2014-06-20","","University of Glasgow","Journal of Physics B","","","","IOP Publishing","2014","","0","","Cavity-enabled high-dimensional quauntum key distribution","10.1088/0953-4075/47/15/155501","0.9911504424778761"
"","","2085.1","","","","2014-06-23","","University of Glasgow","Transformation Groups","","","","Springer Nature","2014","","0","","ENDOMORPHISMS OF VERMA MODULES FOR RATIONAL CHEREDNIK ALGEBRAS","10.1007/s00031-014-9281-x","1.0"
"","","1609.2","","","","2014-06-25","","University of Glasgow","Culture, Health & Sexuality ","","","","Informa UK Limited","2014","","1","","The stigmatisation of abortion: a qualitative analysis of print media in Great Britain in 2010","10.1080/13691058.2014.937463","1.0"
"","","1609.2","","","","2014-06-25","","University of Glasgow","African Journal of AIDS Research","","","","Informa UK Limited","2014","","0","","“Mum never loved me.” How structural factors influence adolescent sexual and reproductive health through parent-child connectedness: A qualitative study in rural Tanzania","10.2989/16085906.2014.945387","0.9823529411764705"
"","","1500","","","","2014-06-26","","University of Glasgow","Methods in Ecology and Evolution","","","","Wiley-Blackwell","2014","","0","","Extension of Nakagawa & Schielzeth’s R^2[GLMM] to random slopes models","10.1111/2041-210x.12225","0.9481481481481482"
"","","921.6","EUR","","","2014-06-27","","University of Glasgow","Frontiers in Endocrinology","","","","Frontiers Media SA","2014","","0","","Treatment of type 2 diabetes by free fatty acid receptor agonists","10.3389/fendo.2014.00137","1.0"
"","","976.87","","","","2014-06-30","","University of Glasgow","Electron Device Letters ","","","","Institute of Electrical and Electronics Engineers (IEEE)","2014","","0","","A Sub-Critical Barrier Thickness Normally-Off AlGaN/GaN MOS-HEMT","10.1109/led.2014.2334394","1.0"
"","","308.27","","","","2014-07-09","","University of Glasgow","British journal of Haematology ","","","","Wiley-Blackwell","2014","","0","","JAK2/STAT5 inhibition by nilotinib with ruxolitinib contributes to the elimination of chronic phase CML CD34+ cells in vitro and in vivo ","10.1182/blood-2013-12-545640","0.9420849420849421"
"","","2085.6","EUR","","","2014-07-09","","University of Glasgow","Stochastic Environmental Research and Risk Assessment'","","","","Springer Nature","2014","","0","","A comparison of clustering approaches for the study of the temporal coherence of multiple time series","10.1007/s00477-014-0931-2","1.0"
"","","964.21","","","","2014-07-10","","University of Glasgow","Spatial and Spatio-temporal Epidemiology","","","","Elsevier BV","2014","","0","","A Spatio-temporal model for estimating the long-term effects of air pollution on respiratory hospital admissions in Greater London","10.1016/j.sste.2014.05.001","1.0"
"","","1251.83","EUR","","","2014-07-11","","University of Glasgow","","","","","University of Nebraska Press","2014","","0","","Gender differences in the temporal voice areas","10.3389/fnins.2014.00228","1.0"
"","","2839","","","","2014-07-15","","University of Glasgow","American Journal of Epidemiology","","","","Oxford University Press (OUP)","2014","","0","","Assessing the representativeness of population-sampled health surveys through linkage to administrative data on alcohol-related outcomes ","10.1093/aje/kwu207","0.9963369963369964"
"","","1500","","","","2014-07-17","","University of Glasgow","Transactions of the Institute of British Geographers","","","","Wiley-Blackwell","2014","","0","","The Tactile Topologies of Contagion","",""
"","","2040","","","","2014-07-22","","University of Glasgow","Classical and Quantum Gravity","","","","IOP Publishing","2014","","0","","Passive Newtonian-noise suppression for gravitational-wave  observatories based on shaping of the local topography","10.1088/0264-9381/31/18/185011","0.986784140969163"
"","","784.06","USD","","","2014-07-22","","University of Glasgow","Optics Express","","","","Optical Society of America","2014","","0","","Four directional stereo-microscopy for 3D particle tracking with real-tim error evaluation","10.1364/oe.22.018662","0.9834254143646409"
"","","400","","","","2014-07-23","","University of Glasgow","Curtural Geographies","","","","SAGE Publications","2014","","0","","Sounding ruins: reflections on the production of an 'audio drift'","10.1177/1474474014542745","0.9692307692307692"
"","","402","","","","2014-07-23","","University of Glasgow","Journal of Virology ","","","","American Society for Microbiology","2014","","0","","A Single Amino Acid Substitution in the Novel H7N9 Influenza A Virus NS1 Protein Increases CPSF30 Binding and Virulence","10.1128/jvi.01567-14","1.0"
"","","1500","","","","2014-07-24","","University of Glasgow","Journal of the Royal Statistical Society: Series C (Applied Statistics)","","","","Wiley-Blackwell","2014","","0","","Spatially Weighted Functional Clustering of River Network Data","10.1111/rssc.12082","1.0"
"","","2296.07","USD","","","2014-07-25","","University of Glasgow","Journal of Organic Chemistry","","","","American Chemical Society (ACS)","2014","","0","","Preparation of Amino-Substituted Indenes and 1,4-Dihydronaphthalenes Using a One-Pot Multi-Reaction Approach: Total Synthesis of Oxybenzo[c]phenanthridine Alkaloids","10.1021/jo5014492","0.9969418960244648"
"","","2726.89","USD","","","2014-07-28","","University of Glasgow","Inorganic Chemistry","","","","American Chemical Society (ACS)","2014","","0","","Exchange interactions at the origin of slow relaxation of the magnetization in {TbCu3} and {DyCu3} single-molecule magnets","10.1021/ic500885r","1.0"
"","","1357.7","USD","","","2014-07-29","","University of Glasgow","Optics Express","","","","Optical Society of America","2014","","0","","Ge/SiGe Quantum Confined Stark Effect Electro-Absorption Modulation withLow Voltage Swing at ? = 1550 nm","10.1364/oe.22.019284","0.9856459330143541"
"","","1500","","","","2014-07-29","","University of Glasgow","Journal of Viral Hepatitis","","","","Wiley-Blackwell","2014","","0","","Elevated interferon stimulated gene transcription in peripheral blood mononuclear cells occurs in patients infected with genotype 1 but not genotype 3 hepatitis C virus","10.1111/jvh.12310","0.9940476190476191"
"","","1609.2","","","","2014-07-29","","University of Glasgow","Business History","","","","Informa UK Limited","2014","","0","","Trust is good, control is better”: The 1974 Herstatt-Bank Crisis and its Implications for International Regulatory Reform","10.1080/00076791.2014.950956","0.9794238683127572"
"","","1004.4","USD","","","2014-08-01","","University of Glasgow","PLOSONE","","","","Public Library of Science (PLoS)","2014","","0","","Maternal condition but not corticosterone is linked to offspring sex ratio in a passerine bird","10.1371/journal.pone.0110858","1.0"
"","","847.8","USD","","","2014-08-05","","University of Glasgow","Physical Review X","","","","American Physical Society (APS)","2014","","0","","Source redshifts from gravitational-wave observations of binary   neutron star mergers","10.1103/physrevx.4.041004","0.9882352941176471"
"","","2040","","","","2014-08-05","","University of Glasgow","Journal of Optics","","","","IOP Publishing","2014","","0","","Two-particle multi-mode interference","10.1088/2040-8978/16/10/105710","1.0"
"","","200","","","","2014-08-05","","University of Glasgow","Journal of Family History","","","","SAGE Publications","2014","","0","","State Regulation, Family Breakdown and Lone Motherhood: The Hidden Costs of World War I in Scotland’","","0"
"","","1080","","","","2014-08-13","","University of Glasgow","New Journal of Physics","","","","IOP Publishing","2014","","0","","Optical Dirac equation","10.1088/1367-2630/16/9/093008","1.0"
"","","1227.99","","","","2014-08-13","","University of Glasgow","Journal of Neuroscience Methods","","","","Elsevier BV","2014","","0","","Cluster-based computational methods for mass univariate analyses of event-related brain potentials/fields: a simulation study","10.1016/j.jneumeth.2014.08.003","1.0"
"","","1500","","","","2014-08-14","","University of Glasgow","Quarterly Journal of Engineering Geology and Hydrogeology","","","","The Geological Society","2014","","0","","Quantification of potential macroseismic effects of the induced seismicity that might result from hydraulic fracturing for shale gas exploitation in the UK ","10.1144/qjegh2014-011","0.9967845659163987"
"","","2040","","","","2014-08-15","","University of Glasgow","Laser Physics Letters","","","","IOP Publishing","2014","","0","","240 GHz pedestal-free colliding-pulse mode-locked laser with a wide operation range","10.1088/1612-2011/11/11/115804","0.9879518072289156"
"","","2040","","","","2014-08-15","","University of Glasgow","Journal of Optics","","","","IOP Publishing","2014","","0","","Entropic uncertainty minimum for angle and angular momentum","10.1088/2040-8978/16/10/105404","1.0"
"","","1657","","","","2014-08-20","","University of Glasgow","Journal of Epidemiology and Community Health","","","","BMJ","2014","","0","","Is changing status through housing tenure associated with changes in mental health? Results from the British Household Panel Survey","10.1136/jech-2014-203990","1.0"
"","","200","","","","2014-08-20","","University of Glasgow","Statistical Modelling","","","","SAGE Publications","2014","","0","","Quasi-periodic spatiotemporal models of brain activation in single-trial MEG experiments","10.1177/1471082x14524673","0.9772727272727273"
"","","1123.03","USD","","","2014-08-22","","University of Glasgow","Journal of Tissue Engineering ","","","","SAGE Publications","2014","","0","","SCANNING ELECTRON MICROSCOPICAL OBSERVATION OF AN OSTEOBLAST/OSTEOCLAST CO-CULTURE ON MICROPATTERNED ORTHOPAEDIC CERAMICS","10.1177/2041731414552114","1.0"
"","","300","","","","2014-08-22","","University of Glasgow","Policy and Politics","","","","Policy press","2014","","0","","Bourdieu and the Big Society: empowering the powerful in public service provision?","10.1332/030557314x14080105693951","1.0"
"","","1374.72","","","","2014-08-26","","University of Glasgow","Optics Express","","","","Optical Society of America","2014","","0","","Mode-locking and frequency mixing at THz pulse repetition rates in a sampled-grating DBR mode-locked laser","10.1364/oe.22.021690","1.0"
"","","2059.2","","","","2014-08-26","","University of Glasgow","Animal Behaviour","","","","Elsevier BV","2014","","0","","Maternal inbreeding reduces parental care in the zebra finch, Taeniopygia guttata ","10.1016/j.anbehav.2014.09.012","0.9938650306748467"
"","","1740","","","","2014-08-28","","University of Glasgow","Lab on a chip","","","","Royal Society of Chemistry (RSC)","2014","","0","","Microfluidic resonant cavities enable acoustophoresis on a disposable superstrate","10.1039/c4lc00749b","1.0"
"","","1350","","","","2014-08-29","","University of Glasgow","PLOS One","","","","Public Library of Science (PLoS)","2014","","0","","A complex network of interactions between mitotic kinases, phosphatases and ESCRT proteins regulates septation and membrane trafficking in S. pombe","10.1371/journal.pone.0111789","1.0"
"","","1500","","","","2014-09-01","","University of Glasgow","Journal of Tissue Engineering and Regenerative Medicine ","","","","Wiley-Blackwell","2014","","0","","Using Biomaterials to Study Stem Cell Mechanotransduction, Growth and Differentiation","10.1002/term.1957","1.0"
"","","2285.17","EUR","","","2014-09-02","","University of Glasgow","Mechanics and Physics of Solids","","","","Elsevier BV","2014","","0","","Modelling volumetric growth in a thick walled fibre reinforced artery","10.1016/j.jmps.2014.09.003","1.0"
"","","2077.43","EUR","","","2014-09-03","","University of Glasgow","Geochimica et Cosmochimca Acta","","","","Elsevier BV","2014","","0","","Aragonite, breunnerite, calcite and dolomite in the CM carbonaceous chondrites: High fidelity recorders of progressive parent body aqueous alteration","10.1016/j.gca.2014.08.019","1.0"
"","","1500","","","","2014-09-03","","University of Glasgow","EMBO Journal","","","","Wiley-Blackwell","2014","","0","","The chemokine receptors ACKR2 and CCR2 reciprocally regulate lymphatic vessel density.","10.15252/embj.201488887","0.9941520467836257"
"","","1472.53","USD","","","2014-09-03","","University of Glasgow","PNAS","","","","PNAS","2014","","0","","A language-familiarity effect for speaker discrimination without comprehension","10.1073/pnas.1401383111","1.0"
"","","2753.06","USD","","","2014-09-05","","University of Glasgow","Journal of Virology","","","","American Society for Microbiology","2014","","0","","A synthetic Biology Approach For a Vaccine Platform Against Known and Newly Emerging Serotypes of Bluetongue Virus","10.1128/jvi.02183-14","1.0"
"","","1740","","","","2014-09-11","","University of Glasgow","Monthly Notices of the Royal Astronomical Society","","","","","2014","","0","","Electron Acceleration by Magnetic Collapse During Decoupling","10.1093/mnras/stu1857","1.0"
"","","1830","USD","","","2014-09-12","","University of Glasgow","American Journal of Public Health","","","","American Public Health Association","2014","","0","","Coupled ethical-epistemic analysis of public health research and practice: Categorizing variables to improve population health and equity","10.2105/ajph.2014.302279","0.9927007299270073"
"","","2040","","","","2014-09-12","","University of Glasgow","Classical and Quantum Gravity","","","","IOP ","2014","","0","","Design of a speed meter interferometer proof-of-principle experiment","10.1088/0264-9381/31/21/215009","1.0"
"","","1800","","","","2014-09-15","","University of Glasgow","Journal of Public Health","","","","Oxford University Press (OUP)","2014","","0","","Representations of minimum unit pricing for alcohol in UK newspapers: a case study of a public health policy debate","10.1093/pubmed/fdu078","1.0"
"","","1472.53","USD","","","2014-09-15","","University of Glasgow","PNAS","","","","","2014","","0","","Chloride channels in stellate cells are essential for uniquely high secretion rates in neuropeptidestimulated Drosophila diuresis","10.1073/pnas.1412706111","0.9883268482490273"
"","","2928","USD","","","2014-09-17","","University of Glasgow","ACS Nano","","","","American Chemical Society (ACS)","2014","","0","","Nanotopographical induction of osteogenesis through adhesion, bone morphogenic protein co-signaling and regulation of microRNAs","10.1021/nn504767g","0.9921259842519685"
"","","2040","","","","2014-09-18","","University of Glasgow","IOP Classical and Quantum Gravity","","","","IOP Publishing","2014","","0","","Design of a speed meter interferometer proof-of-principle experiment","10.1088/0264-9381/31/21/215009","1.0"
"","","1500","","","","2014-09-18","","University of Glasgow","Cellular Microbiology","","","","Wiley-Blackwell","2014","","0","","Bacterial secreted effectors and caspase-3 interactions","10.1111/cmi.12368","1.0"
"","","1242.93","USD","","","2014-09-19","","University of Glasgow","Plant Physiology","","","","American Society of Plant Biologists","2014","","0","","Voltage-sensor transitions of the inward-rectifying K+ channel KAT1 indicate a latching mechanism biased by hydration within the voltage sensor","10.1104/pp.114.244319","1.0"
"","","1296","","","","2014-09-19","","University of Glasgow","Proceedings A","","","","The Royal Society","2014","","0","","Light's Twist","","0"
"","","2077.43","","","","2014-09-19","","University of Glasgow"," Geochemica et Cosmochimica Acta","","","","Elsevier BV","2014","","0","","The paradox between low shock-stage and evidence for compaction in CM carbonaceous chondrites explained by multiple low-intensity impacts","10.1016/j.gca.2014.09.014","1.0"
"","","988.2","","","","2014-09-22","","University of Glasgow","PLOS ONE","","","","Public Library of Science (PLoS)","2014","","0","","To what extent do financial strain and labour force status explain social class inequalities in self-rated health? Analysis of 20 countries in the European Social Survey","10.1371/journal.pone.0110362","1.0"
"","","2077.43","","","","2014-09-23","","University of Glasgow","Social Science and Medicine","","","","Elsevier BV","2014","","0","","Adolescent socio-economic and school-based social status, health and well-being","10.1016/j.socscimed.2014.09.037","1.0"
"","","3360","","","","2014-09-24","","University of Glasgow","Immunology & Cell Biology","","","","Springer Nature","2014","","0","","The atypical chemokine receptor ACKR2 suppresses Th17 responses to protein autoantigens","10.1038/icb.2014.90","1.0"
"","","2550","","","","2014-09-25","","University of Glasgow","BMJ Open ","","","","BMJ","2014","","0","","Evaluation of Health in Pregnancy grants in Scotland: a protocol for a natural experiment","10.1136/bmjopen-2014-006547","1.0"
"","","1004.4","USD","","","2014-09-29","","University of Glasgow","PLOS One","","","","Public Library of Science (PLoS)","2014","","0","","Estimating the potential impact of canine distemper virus on the Amur tiger population (Panthera tigris altaica) in Russia","10.1371/journal.pone.0110811","1.0"
"","","3462.38","","","","2014-09-30","","University of Glasgow","Current Biology","","","","Elsevier BV","2014","","0","","With age comes representational wisdom in social signals'  ","10.1016/j.cub.2014.09.075","0.9739130434782609"
"","","1194","","","","2014-10-03","","University of Glasgow","Journal of Organizational Effectiveness: People and Performance","","","","Emerald","2014","","0","","Organisational ineffectiveness: environmental shifts and the transition to crisis","10.1108/joepp-09-2014-0061","1.0"
"","","1500","","","","2014-10-03","","University of Glasgow","Ratio","","","","Wiley-Blackwell","2014","","0","","""IS THE SENSE-DATA THEORY A REPRESENTATIONALIST THEORY?” ","10.1111/rati.12085","0.972972972972973"
"","","1709.28","EUR","","","2014-10-06","","University of Glasgow","Clinical Neurophysiology","","","","Elsevier BV","2014","","0","","Influence of Motor Imagination on Cortical Activation During Functional Electrical Stimulation ","10.1016/j.clinph.2014.10.007","0.9947089947089947"
"","","2915","","","","2014-10-06","","University of Glasgow","Nature Communications","","","","Springer Nature","2014","","0","","Evolution of Oil Droplets in a Chemo-Robotic Platform","10.1038/ncomms6571","0.9904761904761905"
"","","1740","","","","2014-10-07","","University of Glasgow","Physical Chemistry Chemical Physics","","","","Royal Society of Chemistry (RSC)","2014","","0","","Optical Activity in the Scattering of Structured Light","10.1039/c4cp03505d","1.0"
"","","1500","","","","2014-10-08","","University of Glasgow","International Journal for Numerical Methods in Biomedical Engineering","","","","Wiley-Blackwell","2014","","0","","A Finite Strain Nonlinear Human Mitral Valve Model with Fluid Structure Interaction","10.1002/cnm.2691","0.9879518072289156"
"","","2976","USD","","","2014-10-10","","University of Glasgow","Nano Letters","","","","American Chemical Society (ACS)","2014","","0","","Determining the Electronic Performance Limitations in Top-Down Fabricated Si Nanowires with Mean Widths Down to ?4 nm","10.1021/nl5015298","0.9871244635193133"
"","","1500","","","","2014-10-15","","University of Glasgow","Journal of Biomedical Materials Research: Part B - Applied Biomaterials ","","","","Wiley-Blackwell","2014","","0","","The Influence of Particle Size and Static Magnetic Fields on the Uptake of Magnetic Nanoparticles into Three Dimensional Cell-Seeded Collagen Gel Cultures","10.1002/jbm.b.33302","1.0"
"","","2311.08","","","","2014-10-15","","University of Glasgow","Drugs: Education, Prevention and Policy","","","","Informa Healthcare","2014","","0","","How did policy actors use mass media to influence the Scottish alcohol minimum unit pricing debate? Comparative analysis of newspapers, evidence submissions and interviews","10.3109/09687637.2014.977228","1.0"
"","","1609.2","","","","2014-10-16","","University of Glasgow","European Security","","","","Informa UK Limited","2014","","0","","Voluntary Organisations and Society-Military Relations in Contemporary Russia","10.1080/09662839.2014.968134","0.974025974025974"
"","","1401.7","USD","","","2014-10-17","","University of Glasgow","Optics Express","","","","Optical Society of America","2014","","0","","Spin Canting Induced Large Nonreciprocal Goos-Hänchen Shifts","10.1364/oe.22.028467","0.9473684210526315"
"","","967.2","USD","","","2014-10-20","","University of Glasgow","The Auk","","","","The American Ornithologists' Union (BioOne)","2014","","0","","Resource partitioning in three congeneric sympatrically breeding seabirds: Foraging areas and prey utilization","10.1642/auk-13-243.1","1.0"
"","","1709.28","EUR","","","2014-10-21","","University of Glasgow","Applied Catalysis A: General","","","","Elsevier BV","2014","","0","","The role of preparation route upon the ambient pressure ammonia synthesis activity of Ni2Mo3N","10.1016/j.apcata.2014.10.030","1.0"
"","","1683.5","","","","2014-10-24","","University of Glasgow","Physical Review Letters","","","","American Physical Society (APS)","2014","","0","","Is the angular momentum of an electron conserved in a uniform magnetic field?","10.1103/physrevlett.113.240404","1.0"
"","","1400","","","","2014-10-27","","University of Glasgow","Perception","","","","Pion","2014","","0","","Dissociation of prediction from conscious perception","10.1068/p7766","1.0"
"","","1450","","","","2014-10-27","","University of Glasgow","CrystEngComm","","","","Royal Society of Chemistry (RSC)","2014","","0","","Structure-Directing Factors when Introducing Hydrogen Bond Functionality to Metal-Organic Frameworks","10.1039/c4ce01379d","0.99"
"","","1700","","","","2014-10-27","","University of Glasgow","Classical and Quantum Gravity","","","","IOP Publishing","2014","","0","","Measurement of the mechanical loss of prototype GaP/AlGaP crystalline coatings for future gravitational wave detectors","10.1088/0264-9381/32/3/035002","1.0"
"","","1350","","","","2014-10-27","","University of Glasgow","PLOS One","","","","Public Library of Science (PLoS)","2014","","0","","Germ-line transmitted, chromosomally integrated HHV-6 and classical Hodgkin lymphoma","10.1371/journal.pone.0112642","1.0"
"","","2085.6","EUR","","","2014-10-29","","University of Glasgow","Behavioural Ecology & Sociology","","","","Springer Nature","2014","","0","","Fish swimming in schools save energy regardless of their spatial position","10.1007/s00265-014-1834-4","1.0"
"","","1657.5","","","","2014-10-31","","University of Glasgow","BMJ Open ","","","","BMJ publishing group","2014","","0","","Barriers to uptake and use of Pre-Exposure Prophylaxis (PrEP) amongst communities most affected by HIV in the UK: Findings from a qualitative study in Scotland","10.1136/bmjopen-2014-005717","0.9936708860759493"
"","","1497.6","","","","2014-11-04","","University of Glasgow","Frontiers in Human Neuroscience","","","","Frontiers Media SA","2014","","0","","Body-Selective Area in the Visual Cortex are less active in Children than in Adults","10.3389/fnhum.2014.00941","0.9940119760479041"
"","","2304","USD","","","2014-11-06","","University of Glasgow","Journal of Genetics and Genomics","","","","Elsevier BV","2014","","0","","Lifespan Modulation in Mice and the Confounding Effects of Genetic Background ","10.1016/j.jgg.2014.06.002","0.9935483870967742"
