"2640","2191.2","2191.2","EUR","","","2014-01-17","","University of Glasgow","Biological Cybernetics","","","","Springer Nature","2014","","0","","Intermittent Control Models of Human Standing: Similarities and Differences","10.1007/s00422-014-0587-5","1.0"
"","","2390.11","EUR","","","2014-01-17","","University of Glasgow","Dyes and Pigments","","","","Elsevier BV","2014","","0","","Facile synthesis of metal-free organic dyes featuring a thienylethynyl spacer for dye sensitized solar cells","10.1016/j.dyepig.2014.01.004","1.0"
"","","2040","","","","2014-01-22","","University of Glasgow","Classical and Quantum Gravity ","","","","IOP Publishing","2014","","0","","Experimental Results for Nulling the Effective Thermal Expansion Coefficient of Fused Silica Fibres Under a Static Stress","10.1088/0264-9381/31/6/065010","1.0"
"","","1260","","","","2014-01-23","","University of Glasgow","Biology Letters","","","","Royal Society of London","2014","","0","","Prior hormetic priming is costly under environmental mismatch","10.1098/rsbl.2013.1010","1.0"
"","","1500","","","","2014-01-27","","University of Glasgow","British Journal of Pharmacology","","","","Wiley-Blackwell","2014","","0","","Epac and HARBS-PDE4 modulate neurite outgrowth and myelination using an in vitro spinal cord injury model","10.1111/bph.12588","0.808"
"","","2404.45","EUR","","","2014-01-28","","University of Glasgow","Applied Energy","","","","Elsevier BV","2014","","0","","The Effect of Temperature Mismatch on Thermoelectric Generators Electrically Connected in Series and Parallel (APEN-D-13-04628R1)","10.1016/j.apenergy.2014.02.030","0.9159663865546218"
"","","976.87","USD","","","2014-01-28","","University of Glasgow","IEEE Transactions on Power Electronics ","","","","Institute of Electrical and Electronics Engineers (IEEE)","2014","","0","","Maximum Power Point Tracking Converter Based on the Open-Circuit Voltage Method for Thermoelectric Generators","10.1109/tpel.2014.2313294","1.0"
"","","1260","","","","2014-01-31","","University of Glasgow","Proceedings of the Royal Society B","","","","The Royal Society","2014","","0","","Habitat-mediated population limitationin a colonial central-place forager:the sky is not the limit for the black-browed albatross","10.1098/rspb.2013.2883","0.9923076923076923"
"","","2548.79","EUR","","","2014-02-03","","University of Glasgow","Synlett","","","","Thieme","2014","","0","","One-Pot Multi-Reaction Processes: Synthesis of Natural Products and Drug-Like Scaffolds","10.1055/s-0033-1340683","1.0"
"","","200","","","","2014-02-03","","University of Glasgow","cultural geographies","","","","SAGE Publications","2014","","0","","'No news today': talk of witnessing with families of missing people","10.1177/1474474014530962","0.9701492537313433"
"2618","2190.31","2190.31","EUR","","","2014-02-04","","University of Glasgow","Letters in Mathematical Physics","","","","Springer Nature","2014","","0","","Quantum cohomology via vicious and osculating walkers","10.1007/s11005-014-0685-2","1.0"
"1080","896.4","896.4","EUR","","","2014-02-06","","University of Glasgow","European Physical Journal A","","","","EDP Sciences","2014","","0","","Measurement of the beam-helicity asymmetry I? in the photoproduction of  0 ±-pairs off protons and off neutrons","10.1140/epja/i2014-14054-5","0.8962655601659751"
"2310.26","1917.51","1917.51","EUR","","","2014-02-06","","University of Glasgow","Sensors & Actuators A","","","","Elsevier BV","2014","","0","","A cymbal transducer for power ultrasonics applications ","10.1016/j.sna.2014.02.024","0.9908256880733946"
"","","2250","","","","2014-02-10","","University of Glasgow","Angewandte Chemie","","","","Wiley-Blackwell","2014","","0","","Rapid, Label-free, Ultrasonic Isopycnic Separations of Cells for Medical Diagnostics","",""
"","","1500","","","","2014-02-11","","University of Glasgow","Financial Accountability and Management","","","","Wiley-Blackwell","2014","","0","","What lies beneath? The role of informal and hidden networks in the management of crises","10.1111/faam.12038","1.0"
"594","356.4","356.4","USD","","","2014-02-11","","University of Glasgow","The Astrophysical Journal Letters","","","","IOP Publishing","2014","","0","","Glitch or Anti-Glitch: a Bayesian View","10.1088/2041-8205/784/2/l41","1.0"
"5000","3010.24","3010.24","USD","","","2014-02-14","","University of Glasgow","Biomacromolecules","","","","American Chemical Society (ACS)","2014","","0","","How cellulose stretches: synergism between covalent and hydrogen bonding","10.1021/bm401616n","1.0"
"2218.8","1367.69","1367.69","USD","","","2014-02-17","","University of Glasgow","Optics Express","","","","Optical Society of America","2014","","0","","Dynamic stereo microscopy for studying particle sedimentation","10.1364/oe.22.004671","1.0"
"","","1500","","","","2014-02-17","","University of Glasgow","Plant Journal","","","","Wiley-Blackwell","2014","","0","","Clustering of the K+ channel GORK of Arabidopsis parallels its gating by extracellular K+","10.1111/tpj.12471","0.9943502824858758"
"2000","1101.09","1101.09","USD","","","2014-02-20","","University of Glasgow","Analytical Chemistry","","","","American Chemical Society (ACS)","2014","","0","","Gradient Microfluidics Enables Rapid Bacterial Growth Inhibition Testing","10.1021/ac5001306","1.0"
"2221.4","1833.54","1833.54","EUR","","","2014-02-21","","University of Glasgow","Acta Astronautica","","","","Elsevier BV","2014","","0","","Experimental Investigation on Shock Wave Diffraction Over Sharp and Curved Splitters","10.1016/j.actaastro.2014.02.018","1.0"
"","","1500","","","","2014-02-24","","University of Glasgow","Biometrics","","","","Wiley-Blackwell","2014","","0","","A Bayesian localised conditional autoregressive model for estimating the health effects of air pollution","10.1111/biom.12156","0.9903846153846154"
"1599.42","1327.52","1327.52","EUR","","","2014-02-25","","University of Glasgow","Personality and Individual Differences","","","","Elsevier BV","2014","","0","","Individual differences in pathogen disgust predict men’s, but not women’s, preferences for facial cues of weight. ","10.1016/j.paid.2013.07.015","0.9911504424778761"
"2665.69","2212.52","2212.52","EUR","","","2014-02-27","","University of Glasgow","Journal of Pain","","","","Elsevier BV","2014","","0","","Dynamic Oscillatory Signatures of Central Neuropathic Pain in Spinal Cord Injury","10.1016/j.jpain.2014.02.005","1.0"
"","","1609.2","","","","2014-03-05","","University of Glasgow","West European Politics","","","","Informa UK Limited","2014","","0","2014","Don't Blame the Euro: Historical Reflections on the Roots of the Eurozone Crisis","10.1080/01402382.2014.929353","0.9875"
"","","1740","","","","2014-03-05","","University of Glasgow","Journal of Materials Chemistry A","","","","Royal Society of Chemistry (RSC)","2014","","0","2014","Muon studies of Li+ diffusion in LiFePO4 nanoparticles of different polymorphs","10.1039/c4ta00543k","1.0"
"","","1500","","","","2014-03-06","","University of Glasgow","Rapid Communications in Mass Spectrometry ","","","","Wiley-Blackwell","2014","","0","","Quantifying precision and accuracy on measurements of dissolved inorganic carbon stable isotopic composition using continuous-flow isotope-ratio mass spectrometry","10.1002/rcm.6873","0.9938271604938271"
"","","200","","","","2014-03-10","","University of Glasgow","History of Psychiatry","","","","SAGE Publications","2014","","0","","The world is full of big bad wolves’: investigating the experimental therapeutic spaces of R.D. Laing and Aaron Esterson","10.1177/0957154x14529222","0.995850622406639"
"2932.26","2433.78","2433.78","EUR","","","2014-03-13","","University of Glasgow","Remote Sensing of Environment","","","","Elsevier BV","2014","","0","","Evaluating sub-pixel offset techniques as an alternative to D-InSAR for monitoring episodic landslide movements in vegetated terrain","10.1016/j.rse.2014.03.003","1.0"
"","","2040","","","","2014-03-14","","University of Glasgow","Classical and Quantum Gravity ","","","","IOP Publishing","2014","","0","","Enhanced Characteristics of Fused Silica Fibres Using Laser Polishing","10.1088/0264-9381/31/10/105006","0.9855072463768116"
"2665.69","2185.87","2185.87","EUR","","","2014-03-14","","University of Glasgow","Trends in Ecology and Evolution","","","","Elsevier BV","2014","","0","","Assembling evidence for identifying reservoirs of infection","10.1016/j.tree.2014.03.002","1.0"
"2700","1593","1593","USD","","","2014-03-20","","University of Glasgow","Journal of Biological Chemistry","","","","American Society for Biochemistry & Molecular Biology (ASBMB)","2014","","0","2014","The N-terminal region of the atypical chemokine receptor ACKR2 is a key determinant of ligand binding","10.1074/jbc.m113.534545","1.0"
"","","200","","","","2014-03-21","","University of Glasgow","Statistical Methods in Medical Research","","","","SAGE Publications","2014","","0","","Controlling for localised spatio-temporal autocorrelation in long-term air pollution and health studies","10.1177/0962280214527384","1.0"
"1954.84","1622.51","1622.51","EUR","","","2014-03-24","","University of Glasgow","Advances in Space Research","","","","Elsevier BV","2014","","0","","Development status of AEOLDOS - a deorbit module for small satellites Advances in Space Research","10.1016/j.asr.2014.03.022","0.8242424242424242"
"","","1500","","","","2014-03-24","","University of Glasgow","Equine Veterinary Journal","","","","Wiley-Blackwell","2014","","0","","What is needed to prevent tendon injury in equine athletes? A conversation between researchers and industry stakeholders","10.1111/evj.12269","0.9302325581395349"
"","","1500","","","","2014-03-24","","University of Glasgow","Small","","","","Wiley-Blackwell","2014","","0","","Spatially selecting single cell for lysis using light induced electric fields ","10.1002/smll.201400247","0.9681528662420382"
"800","587.1","587.1","USD","","","2014-03-26","","University of Glasgow","Plant Physiology","","","","Dartmouth Journals","2014","","0","","Systems analysis of guard cell membrane transport for enhanced stomatal dynamics and water use efficiency","10.1104/pp.113.233403","1.0"
"","","1989","","","","2014-01-13","","University of Glasgow","Journal of Epidemiology and Community health","","","","BMJ","2014","","0","","Differences in Adiposity Trajectories by Birth Cohort and Childhood Social Class: Evidence from Cohorts born in the 1930s, 1950s and 1970s in the West of Scotland","10.1136/jech-2013-203551","1.0"
"","","2550","","","","2014-01-28","","University of Glasgow","British Medical Journal","","","","BMJ","2014","","0","2014","Explaining trends in Scottish coronary heart disease mortality between 2000 and 2010: socioeconomic analysis using the IMPACTSEC model. ","10.1136/jech-2013-203126.53","0.9010989010989011"
"","","2550","","","","2014-01-31","","University of Glasgow","American Journal of Epidemiology","","","","Oxford University Press (OUP)","2014","","0","","Early life school, neighbourhood and family influences on adult health: a multilevel cross-classified analysis of the Aberdeen Children of the 1950s study","10.1093/aje/kwu110","0.987012987012987"
"","","1500","","","","2014-02-04","","University of Glasgow","Perspectives on Sexual and Reproductive Health","","","","Wiley-Blackwell","2014","","0","2014","Access to and experience of later abortion: accounts from women in Scotland","10.1363/46e1214","1.0"
"","","1350","","","","2014-02-14","","University of Glasgow","PLOS One","","","","Public Library of Science (PLoS)","2014","","0","","HIV prevalence and undiagnosed infection among a community sample of gay and bisexual men in Scotland","10.1097/qai.0b013e318058a01e","0.9312169312169312"
"","","1001.48","","","","2014-02-14","","University of Glasgow","PLOS One","","","","Public Library of Science (PLoS)","2014","","0","","Understanding the development of minimum unit pricing of alcohol in Scotland: a qualitative study","10.1371/journal.pone.0091185","0.8981481481481481"
"2649.78","2199.31","2199.31","EUR","","","2014-02-17","","University of Glasgow","Social Science & Medicine ","","","","Elsevier BV","2014","","0","2014","Socioeconomic and geographic inequalities in adolescent smoking: A multilevel cross-sectional study of 15 year olds in Scotland","10.1016/j.socscimed.2014.02.016","1.0"
"","","1602.96","","","","2014-03-03","","University of Glasgow","FEBS Letters","","","","Elsevier BV","2014","","0","","The Role of c-Jun in Controlling the EPAC1-dependent Induction of the SOCS3 Gene in HUVECs","10.1016/j.febslet.2014.02.038","1.0"
"","","1500","","","","2014-03-28","","University of Glasgow","Population, Space and Place","","","","Wiley-Blackwell","2014","","0","","Emigration of Scottish steelworkers to Canada: impacts on social networks","10.1002/psp.1852","1.0"
"600","323.4","323.4","USD","","","2014-03-31","","University of Glasgow","International Journal of Qualitative Methods.","","","","University of Alberta","2014","","0","","Avoiding pitfalls and realising opportunities: reflecting on issues of sampling and recruitment for online focus groups","10.1177/160940691401300109","1.0"
"","","1510.16","CHF","","","2014-04-03","","University of Glasgow","Sensors","","","","MDPI AG","2014","","0","","Luminescent Measurement Systems for the Investigation of a Scramjet Inlet-Isolator","10.3390/s140406606","1.0"
"","","2134.68","EUR","","","2014-04-03","","University of Glasgow","The Veterinary Journal","","","","Elsevier BV","2014","","0","","Estimates of genetic parameters of distal limb fracture and superficial digital flexor tendon injury in UK Thoroughbred racehorses'","10.1016/j.tvjl.2014.03.005","0.9961685823754789"
"","","1657.5","","","","2014-04-03","","University of Glasgow","Journal of Epidemiology and Community Health","","","","BMJ","2014","","0","","You have been QUALIFIED for a smokeless e-cig starter kit","10.1136/jech-2014-203879","1.0"
"","","3600","","","","2014-04-04","","University of Glasgow","International Materials Reviews","","","","Maney Publishing","2014","","0","","Aberration-corrected scanning transmission electron microscopy for atomic-resolution studies of functional oxides","10.1179/1743280413y.0000000026","1.0"
"","","1500","","","","2014-04-04","","University of Glasgow","Laser and Photonics Reviews","","","","Wiley-Blackwell","2014","","0","","A monolithic resonant terahertz sensor element comprising a metamaterial absorber and micro-bolometer","10.1002/lpor.201300087","1.0"
"","","1070.94","","","","2014-04-07","","University of Glasgow","IEEE Transactions on Pattern Analysis and Machine Intelligence","","","","Institute of Electrical and Electronics Engineers (IEEE)","2014","","0","","Pseudo-Marginal Bayesian Inference for Gaussian Processes","10.1109/tpami.2014.2316530","1.0"
"","","2404.45","","","","2014-04-07","","University of Glasgow","Journal of Catalysis","","","","Elsevier BV","2014","","0","","The application of inelastic neutron scattering to investigate CO hydrogenation over an iron Fischer-Tropsch synthesis catalyst","10.1016/j.jcat.2014.02.004","0.9921259842519685"
"","","976.87","","","","2014-04-07","","University of Glasgow","IEEE Transacations on Electron Devices","","","","Institute of Electrical and Electronics Engineers (IEEE)","2014","","0","","Optimization and evaluation of variability in the programing window of a flash cell with molecular metal oxide storage","10.1109/ted.2014.2315520","0.9590163934426229"
"","","3498","","","","2014-04-09","","University of Glasgow","Nature Communications","","","","Springer Nature","2014","","0","","Discovery of gigantic molecular nanostructures using a flow reaction array as a search engine","10.1038/ncomms4715","1.0"
"","","1843.76","EUR","","","2014-04-10","","University of Glasgow","Biological Conservation","","","","Elsevier BV","2014","","0","","Out of sight but not out of harm’s way: human disturbance reduces reproductive success of a cavity-nesting seabird","10.1016/j.biocon.2014.03.020","1.0"
"","","2550","","","","2014-04-14","","University of Glasgow","American Journal of Epidemiology","","","","Oxford University Press (OUP)","2014","","0","","Multilevel analysis of individual heterogeneity: a fundamental critique of the current probabilistic risk factor epidemiology"" - Response to Invited Commentary","",""
"","","1740","","","","2014-04-14","","University of Glasgow","Chem Comm","","","","Royal Society of Chemistry (RSC)","2014","","0","","Solvatochromic probes for detecting hydrogen-bond-donating solvents","10.1039/c4cc00805g","1.0"
"","","1500","","","","2014-04-15","","University of Glasgow","Milbank Quarterly","","","","Wiley-Blackwell","2014","","0","","Changing Policy Framing as a Deliberate Strategy for Public Health Advocacy: A Qualitative Policy Case Study of Minimum Unit Pricing of Alcohol","10.1111/1468-0009.12057","1.0"
"","","976.87","","","","2014-04-17","","University of Glasgow","IEEE Transactions on Ultrasonics, Ferroelectrics, and Frequency Control","","","","Institute of Electrical and Electronics Engineers (IEEE)","2014","","0","","Smart Cymbal Transducers with Nitinol End-Caps for Multiple Frequency Applications","",""
"","","1260","","","","2014-04-23","","University of Glasgow","Proceedings of the Royal Society B","","","","The Royal Society","2014","","0","","A cross-culture, cross-gender comparison of perspective taking mechanisms","10.1098/rspb.2014.0388","1.0"
"","","1260","","","","2014-04-25","","University of Glasgow","Proceedings of the Royal Society B","","","","The Royal Society","2014","","0","","Can environmental conditions experienced in early life influence future generations?","10.1098/rspb.2014.0311","1.0"
"","","1500","","","","2014-04-25","","University of Glasgow","International Journal for Numerical Methods in Biomedical Engineering","","","","Wiley-Blackwell","2014","","0","","Quasi-static imaged-based immersed boundary-finite element model of human left ventricle in diastole","10.1002/cnm.2652","0.8878048780487805"
"","","1740","","","","2014-04-28","","University of Glasgow","Lab-on-a-Chip","","","","Royal Society of Chemistry (RSC)","2014","","0","","Integrating microfluidic generation, handling and analysis of biomimetic giant unilamellar vesicles","10.1039/c4lc00199k","1.0"
"","","1740","","","","2014-04-28","","University of Glasgow","Lab-on-a-Chip","","","","Royal Society of Chemistry (RSC)","2014","","0","","Cell Patterning with a Heptagon Acoustic Tweezer – Application in Neurite Guidance","10.1039/c4lc00436a","1.0"
"","","1266.86","","","","2014-04-29","","University of Glasgow","Health and Place","","","","Elsevier BV","2014","","0","","The Relative Influence of Neighbourhood Incivilities, Cognitive Social Capital, Club Membership and Individual Characteristics on Positive Mental Health","10.1016/j.healthplace.2014.04.006","1.0"
"","","394","","","","2014-04-29","","University of Glasgow","Journal of Modern Optics","","","","Informa UK Limited","2014","","0","","Advanced technologies for future laser-interferometric gravitational wave detectors","10.1080/09500340.2014.920934","0.9222222222222223"
"","","1675.87","","","","2014-05-02","","University of Glasgow","Advanced Optical Technologies ","","","","Walter de Gruyter GmbH","2014","","0","","Hydroxide catalysis bonding for astronomical instruments","10.1515/aot-2014-0022","1.0"
"","","1347.39","USD","","","2014-05-06","","University of Glasgow","Optics Express","","","","Optical Society of America","2014","","0","","The Mechanical Faraday Effect for Orbital Angular Momentum-Carrying Beams","10.1364/oe.22.011690","0.971830985915493"
"","","1500","","","","2014-05-08","","University of Glasgow","Hepatology","","","","Wiley-Blackwell","2014","","0","","Next generation sequencing sheds light on the natural history of hepatitis C infection in patients that fail treatment","10.1002/hep.27192","0.9702127659574468"
"","","1500","","","","2014-05-12","","University of Glasgow"," Journal of Chemical Technology & Biotechnology ","","","","Wiley-Blackwell","2014","","0","","Iron ochre – a pre-catalyst for the cracking of methane","10.1002/jctb.4434","0.9454545454545454"
"","","1500","","","","2014-05-13","","University of Glasgow","Journal of Animal Ecology","","","","Wiley-Blackwell","2014","","0","","Survival in macaroni penguins and the relative importance of different drivers; individual traits, predation pressure and environmental variability  ","10.1111/1365-2656.12229","0.9864864864864865"
"","","2569.76","USD","","","2014-05-14","","University of Glasgow","Journal of Biological Chemistry","","","","American Society for Biochemistry & Molecular Biology (ASBMB)","2014","","0","","Concomitant action of structural elements and receptor phosphorylation determine arrestin-3 interaction with the free fatty acid receptor FFA4","10.1074/jbc.m114.568816","0.9964912280701754"
"","","1295.53","","","","2014-05-19","","University of Glasgow","Stem Cell Research","","","","Elsevier BV","2014","","0","","Differential sensitivity of Glioma stem cells to Aurora kinase A inhibitors: Implications for stem cell mitosis and centrosome dynamics ","10.1016/j.scr.2014.05.001","0.996309963099631"
"","","2550","","","","2014-05-20","","University of Glasgow","Cerebral Cortex","","","","Oxford University Press (OUP)","2014","","0","","Conversational interaction in the scanner: Mentalizing during language processing as revealed by MEG ID: bhu116","10.1093/cercor/bhu116","0.9478672985781991"
"","","1349.35","USD","","","2014-05-20","","University of Glasgow","Optics Express","","","","Optical Society of America","2014","","0","","High speed switching between arbitrary spatial light profiles","10.1364/oe.22.012845","1.0"
"","","1500","","","","2014-05-20","","University of Glasgow","European Journal of Neuroscience","","","","Wiley-Blackwell","2014","","0","","Prenatal inhibition of the kynurenine pathway leads to structural changes in the hippocampus of adult rat offspring","10.1111/ejn.12535","1.0"
"","","805.48","EUR","","","2014-05-21","","University of Glasgow","Frontiers in Aging Neuroscience","","","","Frontiers Media SA","2014","","0","","A rightward shift in the visuospatial attention vector with healthy aging","10.3389/fnagi.2014.00113","1.0"
"","","2132.55","EUR","","","2014-05-22","","University of Glasgow","Journal of Clinical Epidemiology","","","","Elsevier BV","2014","","0","","Latent class analysis was accurate but sensitive in data simulations","10.1016/j.jclinepi.2014.05.005","1.0"
"","","1260","","","","2014-05-22","","University of Glasgow","Biology Letters","","","","The Royal Society","2014","","0","","Sex ratio influences the motivational salience of facial attractiveness","10.1098/rsbl.2014.0148","1.0"
"","","288.53","JPY","","","2014-05-22","","University of Glasgow","Transactions of JSASS","","","","Aerospace Technology Japan","2014","","0","","Experimental Investigation of Impinging Shock  Cavity Interactions with Upstream Transverse Jet Injection","10.2322/tastj.12.pe_57","0.985781990521327"
"","","1544.31","EUR","","","2014-05-23","","University of Glasgow","Molecular and Cellular Neuroscience","","","","Elsevier BV","2014","","0","","The phosphorylation of Hsp20 enhances its association with amyloid-<beta> to increase protection against neuronal cell death","10.1016/j.mcn.2014.05.002","0.9711934156378601"
"","","2598.69","USD","","","2014-05-25","","University of Glasgow","Journal of Biological Chemistry","","","","American Society for Biochemistry & Molecular Biology (ASBMB)","2014","","0","","The Molecular Basis of Ligand Interaction at Free Fatty Acid Receptor 4","10.1074/jbc.m114.561449","0.9102564102564102"
"","","2100","","","","2014-05-28","","University of Glasgow","IMA Journal of Applied Mathematics","","","","Oxford University Press (OUP)","2014","","0","","Dynamic finite-strain modelling of the human left ventricle in health and disease using an immersed boundary-finite element method","10.1093/imamat/hxu029","1.0"
"","","1772.18","","","","2014-05-30","","University of Glasgow","Journal of African Earth Sciences","","","","Elsevier BV","2014","","0","","Intracontinental deformation in southern Africa during the late Cretaceous","10.1016/j.jafrearsci.2014.05.014","1.0"
"","","1500","","","","2014-06-02","","University of Glasgow","Journal of Animal Ecology","","","","Wiley-Blackwell","2014","","0","","Growth trajectory influences temperature preference in fish through an effect on metabolic rate","10.1111/1365-2656.12244","1.0"
"","","1500","","","","2014-06-02","","University of Glasgow","Functional Ecology","","","","Wiley-Blackwell","2014","","0","","Aerobic scope predicts dominance during early life in a tropical damselfish","10.1111/1365-2435.12296","1.0"
"","","2235","","","","2014-06-06","","University of Glasgow","Bioinformatics","","","","Oxford University Press (OUP)","2014","","0","","MetAssign: probabilistic annotation of metabolites from LC–MS data using a Bayesian clustering approach","10.1093/bioinformatics/btu370","1.0"
"","","2112","EUR","","","2014-06-09","","University of Glasgow","Space Science Reviews","","","","Springer Nature","2014","","0","","Electric Current Circuits in Astrophysics ","10.1007/s11214-014-0041-y","0.9879518072289156"
"","","1706.04","EUR","","","2014-06-09","","University of Glasgow","Computer Networks","","","","Elsevier BV","2014","","0","","A Two-level Markov Model for Packet Loss in UDP/IP-based Real-Time Video Applications Targeting Residential Users","10.1016/j.comnet.2014.05.013","1.0"
"","","1203.6","USD","","","2014-06-10","","University of Glasgow","Physical review letters","","","","American Physical Society (APS)","2014","","0","","Thermal noise of folding mirrors","10.1103/physrevd.90.042001","1.0"
