institution,period,euro,DOI,is_hybrid,publisher,journal_full_title,issn
Hochschule Hannover,2022,874.24,10.3168/jds.2021-20528,FALSE,Elsevier BV,Journal of Dairy Science,1525-3198
Hochschule Hannover,2022,1442.74,10.3390/jpm12050696,FALSE,MDPI AG,Journal of Personalized Medicine,2075-4426
Hochschule Hannover,2022,402.22,10.25968/opus-2321,FALSE,RonPub UG,Open Journal of Big Data,2365-029X
Hochschule Hannover,2022,1716.80,10.1371/journal.pone.0270867,FALSE,Public Library of Science (PLoS),PLOS ONE,1932-6203
Hochschule Hannover,2022,883.80,10.1155/2022/3289330,FALSE,Hindawi Publishing Corporation,Advances in Public Health,2314-7784
