"institution","period","euro","doi","backlist_oa","publisher","book_title","isbn","isbn_print","isbn_electronic","license_ref","indexed_in_crossref","doab"
"Linnaeus University",2025,4520,"10.13068/9789179243982",FALSE,"Arkiv förlag","Integration och underordning i välfärdsstatens tid: Texter om sociologi, sociala problem och socialpolitik","978-91-7924-398-2","978-91-7924-398-2",NA,NA,TRUE,FALSE
"Linnaeus University",2025,5424,"10.13068/9789179244033",FALSE,"Arkiv förlag","Teoretiskt hantverk: Om teoretiserande i samhällsvetenskaplig forskning","978-91-7924-403-3","978-91-7924-403-3",NA,NA,TRUE,FALSE
"Linnaeus University",2025,5424,"10.1017/9781009640817",FALSE,"Cambridge University Press","Negotiating Imperialism","978-1-009-64081-7","978-1-009-64080-0","978-1-009-64081-7","https://www.cambridge.org/core/terms",TRUE,FALSE
"Linnaeus University",2025,5461.34,"10.1163/9789004745766",FALSE,"Brill","Empire of Improvisation","978-90-04-74576-6","978-90-04-74575-9","978-90-04-74576-6",NA,TRUE,FALSE
"Linnaeus University",2025,13637.74,NA,FALSE,"Palgrave MacMillan","Grotesque Anthropocene: Disfigured Environments Across Media","978-3-032-09363-9",NA,NA,NA,FALSE,FALSE
