institution,period,euro,doi,backlist_oa,publisher,book_title,isbn_1,isbn_2,isbn_3
su,2024,5576.27,10.1007/978-3-031-69864-4,FALSE,Springer Nature,"Suffrage, capital and welfare: Conditional citizenship in historical perspective",,,
su,2024,7687.22,10.5040/9781350277069,FALSE,Bloomsbury Publishing,Domestic Workers in Postcolonial Tanzania,,,
su,2024,5014.33,10.16993/bcl,FALSE,Stockholm University Press,Léxico y semántica ,,,
su,2024,7178.42,10.16993/bcn/,FALSE,Stockholm University Press,Indo-European Interfaces ,,,
su,2024,9733.35,10.16993/bcm/,FALSE,Stockholm University Press,"Peter Artedi: Reformer of 18th Century Zoology, Vol. I ",,,
su,2024,2979.11,10.4324/9781032638614,FALSE,Informa UK Limited-,"Childism, Intersectionality and the Rights of the Child",,,
su,2024,5958.46,10.16993/bcq,FALSE,Stockholm University Press,Specialpedagogik som politik och praktik: Specialpedagogiska professioner i den svenska skolan sedan 1980,,,
su,2024,6568.76,10.1017/9781009284417,FALSE,Cambridge University,Family Matters,,,
su,2024,1559.87,10.16993/bco,FALSE,Stockholm University Press,The role of experts in the management of the Covid-19 crisis,,,
