"institution","period","euro","doi","backlist_oa","publisher","book_title","isbn","isbn_print","isbn_electronic","license_ref","indexed_in_crossref","doab"
"Stockholm University",2024,5576.27,"10.1007/978-3-031-69864-4",FALSE,"Springer International Publishing","Suffrage, Capital, and Welfare","978-3-031-69863-7","978-3-031-69863-7","978-3-031-69864-4","https://creativecommons.org/licenses/by/4.0",TRUE,FALSE
"Stockholm University",2024,7687.22,"10.5040/9781350277069",FALSE,"Bloomsbury Publishing","Domestic Work in Postcolonial Tanzania","978-1-350-27706-9","978-1-350-27703-8","978-1-350-27706-9","https://creativecommons.org/licenses/by-nc-nd/4.0/",TRUE,FALSE
"Stockholm University",2024,5014.33,"10.16993/bcl",FALSE,"University of California Press","Léxico y semántica: nuevas aportaciones teóricas y aplicadas","978-91-7635-239-7","978-91-7635-239-7",NA,NA,TRUE,FALSE
"Stockholm University",2024,7178.42,"10.16993/bcn/",FALSE,"Stockholm University Press","Indo-European Interfaces: Integrating Linguistics, Mythology and Archaeology","978-91-7635-218-2","978-91-7635-218-2",NA,NA,TRUE,FALSE
"Stockholm University",2024,9733.35,"10.16993/bcm/",FALSE,"Stockholm University Press","Peter Artedi: Reformer of 18th Century Zoology, Vol. I: Peter Artedi's Life and Works","978-91-7635-243-4","978-91-7635-243-4",NA,NA,TRUE,FALSE
"Stockholm University",2024,2979.11,"10.4324/9781032638614",FALSE,"Routledge","Childism, Intersectionality and the Rights of the Child","978-1-032-63861-4",NA,"978-1-032-63861-4",NA,TRUE,FALSE
"Stockholm University",2024,5958.46,"10.16993/bcq",FALSE,"Stockholm University Press","Specialpedagogik som politik och praktik: Specialpedagogiska professioner i den svenska skolan sedan 1980","978-91-7635-255-7","978-91-7635-255-7",NA,NA,TRUE,FALSE
"Stockholm University",2024,6568.76,"10.1017/9781009284417",FALSE,"Cambridge University Press","Family Matters","978-1-009-28441-7","978-1-009-28440-0","978-1-009-28441-7","https://www.cambridge.org/core/terms",TRUE,FALSE
"Stockholm University",2024,1559.87,"10.16993/bco",FALSE,"Stockholm University Press","Comparing the place of experts during the first waves of the COVID-19 pandemic","978-91-7635-247-2","978-91-7635-247-2",NA,NA,TRUE,FALSE
