"institution","period","euro","doi","backlist_oa","publisher","book_title","isbn","isbn_print","isbn_electronic","license_ref","indexed_in_crossref","doab"
"Scuola Normale Superiore",2025,2548,NA,FALSE,"All'Insegna del Giglio","Urbanistica e politica. Genova tra innovazioni e persistenze","978-88-9285-384-3","978-88-9285-384-3","978-88-9285-385-0",NA,FALSE,FALSE
"Scuola Normale Superiore",2025,9862.08,"10.5771/9783495991404",FALSE,"Verlag Karl Alber","[Chione], Lettere","978-3-495-99140-4","978-3-495-99140-4",NA,"https://creativecommons.org/licenses/by/4.0/",TRUE,FALSE
"Scuola Normale Superiore",2025,7342.56,NA,FALSE,"Il Mulino","La Transnazionalizzazione della Destra Radicale: Identità, reticoli, pratiche","978-88-15-39190-2",NA,NA,NA,FALSE,FALSE
"Scuola Normale Superiore",2025,1814.8,"10.30682/9791254775059",FALSE,"Fondazione Bologna University Press","Filologicamente. Geografia e storia di un mito","979-12-5477-505-9","979-12-5477-505-9",NA,NA,TRUE,FALSE
"Scuola Normale Superiore",2025,835,NA,FALSE,"Edizioni Quasar di S. Tognon srl","L'urbanistica di Ancona","978-88-5491-628-9",NA,NA,NA,FALSE,FALSE
"",,,"","","","","","","","","",""
"Scuola Normale Superiore",2025,5000,"10.36174/0000022",FALSE,"Carocci editore","1625, la Repubblica di Genova in guerra. Un episodio della Guerra dei Trent’anni","978-88-290-3393-5",NA,NA,NA,FALSE,FALSE
