institution,year,euro,doi,backlist_oa,publisher,book_title	,isbn,isbn_print,isbn_electronic,license_ref,indexed_in_crossref,doab
Charles University,2023,"6824,91",10.4324/9781003225249,FALSE,Taylor & Francis,Institutional Translator Training,978-1-03-220979-1,NA,978-1-003-22524-9,https://creativecommons.org/licenses/by-nc-nd/4.0/deed.en,TRUE,FALSE
Charles University,2023,"771,97",10.1007/978-3-031-29800-4_29,FALSE,Springer Nature,How Covid-19 Affected the Slovak and Czech Mathematics and Physics Teachers’ Use of Resources,NA,978-3-031-29799-1,978-3-031-29800-4,https://creativecommons.org/licenses/by/4.0/,TRUE,FALSE
Charles University,2023,"1194,67",10.5772/intechopen.112309,FALSE,IntechOpen,The Influence of Undergraduate Preparation on Professional Beginnings in School Practice of Novice Teachers,978-0-85014-517-5,978-0-85014-516-8,978-0-85014-518-2,https://creativecommons.org/licenses/by/3.0/,TRUE,FALSE
Charles University,2023,"1769,94",10.4324/9781003269748-11,FALSE,Taylor & Francis,When the Margins Enter the Centre,978-1-032-20979-1,978-1-032-21723-9,978-1-003-26974-8,https://creativecommons.org/licenses/by-nc-nd/4.0/deed.en,TRUE,TRUE
Charles University,2023,"1816,40",NA,FALSE,ADJURIS – International Academic Publisher,Ukrainian Law and the Law of the Czech Republic: An Unexpected Encounter,NA,NA,978-606-95862-0-4,NA,FALSE,FALSE