"institution","period","euro","doi","is_hybrid","publisher","journal_full_title","issn","issn_print","issn_electronic","issn_l","license_ref","indexed_in_crossref","pmid","pmcid","ut","url","doaj","agreement"
"Wuerzburg-Schweinfurt FH",2020,2503.4,"10.1007/s42822-020-00026-y",TRUE,"Springer Nature","Behavior and Social Issues","1064-9506","1064-9506","2376-6786","1064-9506","https://creativecommons.org/licenses/by/4.0",TRUE,NA,NA,"ut:000520070400001",NA,FALSE,"DEAL Springer Nature Germany"
"Wuerzburg-Schweinfurt FH",2020,2503.4,"10.1365/s40702-020-00617-8",TRUE,"Springer Fachmedien Wiesbaden GmbH","HMD Praxis der Wirtschaftsinformatik","1436-3011","1436-3011","2198-2775","1436-3011","http://www.springer.com/tdm",TRUE,NA,NA,NA,NA,FALSE,"DEAL Springer Nature Germany"
"Wuerzburg-Schweinfurt FH",2020,2503.4,"10.1365/s40702-020-00616-9",TRUE,"Springer Fachmedien Wiesbaden GmbH","HMD Praxis der Wirtschaftsinformatik","1436-3011","1436-3011","2198-2775","1436-3011","https://creativecommons.org/licenses/by/4.0",TRUE,NA,NA,NA,NA,FALSE,"DEAL Springer Nature Germany"
"Wuerzburg-Schweinfurt FH",2020,2503.4,"10.1365/s40702-020-00615-w",TRUE,"Springer Fachmedien Wiesbaden GmbH","HMD Praxis der Wirtschaftsinformatik","1436-3011","1436-3011","2198-2775","1436-3011","https://www.springer.com/tdm",TRUE,NA,NA,NA,NA,FALSE,"DEAL Springer Nature Germany"
"Wuerzburg-Schweinfurt FH",2020,2503.4,"10.1007/s00521-020-05242-6",TRUE,"Springer Nature","Neural Computing and Applications","0941-0643","0941-0643","1433-3058","0941-0643","https://creativecommons.org/licenses/by/4.0",TRUE,NA,NA,"ut:000559490500003",NA,FALSE,"DEAL Springer Nature Germany"
