2220,2220,2220,GBP,"",2016-12-13,2016-09-01,0955-2359,"University of Manchester","Twentieth Century British History",Unknown,"","","Oxford University Press (OUP)",2016,"Journal Article/Review",0,"","The Burnley Dog War: The Politics of Dog-Walking and the Battle over Public Parks in Post-Industrial Britain"
2597.64,2217.36,2217.36,USD,"",2016-09-30,2016-07-04,"","Queen Mary, University of London","Entertainment Computing","","","","Elsevier BV",2016,"Journal Article/Review",1,2016,"Mood Glove: A Haptic Wearable Prototype System to Enhance Mood Music in Film"
"",2213.96,2213.96,"","",2016-12-13,2016-11-23,"","University of Cambridge","Journal of Science and Medicine in Sport","","","","Elsevier BV",2016,"",0,"","Physical activity and sedentary time in relation to academic achievement in children"
"",2211.21,2211.21,"","",2016-11-27,2016-09-27,"","King's College London","Journal of Virology","","","","American Society for Microbiology",2016,"",0,"","HIV-1 glycan density drives the persistence of the mannose patch within an infected individual"
3117.168,2206.25,2206.25,USD,"",2016-09-30,2016-06-13,"","Queen Mary, University of London","Signal Processing: Image Communication","","","","Elsevier BV",2016,"Journal Article/Review",0,2016,"Methods for Reducing Visual Discomfort in Stereo 3D: A Review"
"",2200,2200,GBP,"",2017-02-13,2017-02-13,"","University of Liverpool","Briefings in Bioinformatics","CC BY","","","Oxford University Press (OUP)",2016,"",0,"","Gene co-expression analysis for functional classification and gene-disease predictions"
2583.53,2194.3212055,"",EUR,"",2017-01-30,2017-01-30,"","University of Liverpool","Applied Acoustics","CC BY","","","Elsevier BV",2016,"",1,"","Levels and sources of neighbour noise in heavyweight residential buildings in Korea….."
2274,2193.58,2193.58,USD,"",2016-11-23,2016-11-16,"",UCL,"Biomedical Optics Express","","","","Optical Society of America",2016,"Journal Article/Review",0,"","Identification and removal of laser-induced noise in photoacoustic imaging using singular value decomposition"
"",2188.39,2188.39,"","",2016-11-08,2017-01-19,"","University of Cambridge","PLOS Pathogens","","","","Public Library of Science (PLoS)",2016,"",0,"","Vaccinia Virus Protein C6 Inhibits Type I IFN Signalling in the Nucleus and Binds to the Transactivation Domain of STAT2"
2489.41,2185.9011328,"",EUR,"",2017-01-16,2017-01-16,"","University of Liverpool",Vaccine,"CC BY","","","Elsevier BV",2016,"",1,"","Re-assessing the total burden of norovirus circulating in the United Kingdom population"
1995,2184.31,2184.31,EUR,"",2016-11-09,2016-03-23,1877-3095,"Cardiff University","International Review of Pragmatics","","","","Brill Academic Publishers",2016,"Journal Article/Review",1,"","“I think” in televised political debate "
2250,2166.24,2166.24,USD,"","","","","University of Oxford","PLoS Computational Biology","","","","Public Library of Science (PLoS)",2016,"",0,"","Effect of the latent reservoir on the evolution of HIV at the within-and between-host levels"
"",2158.54,2158.54,"","",2016-10-13,2016-09-05,"","King's College London","Mathematical biosciences","","","","Elsevier BV",2016,"",0,"","A two-variable model robust to pacemaker behaviour for the dynamics of the cardiac action potential"
"",2153.55,2153.55,"","",2016-12-05,2016-11-17,"","University of Cambridge","Journal of Virology","","","","American Society for Microbiology",2016,"",0,"","Activation of COX-2/PGE2 Promotes Sapovirus Replication via the 2 Inhibition of Nitric Oxide Production"
2500,2152.99,2152.99,EUR,"",2016-12-14,2016-09-29,"",UCL,Endoscopy,"","","","Thieme Publishing Group",2016,"Journal Article/Review",0,"","Improving uptake of flexible sigmoidoscopy screening: a Randomised Controlled Trial of non-participant reminders in the English Screening Programme"
2580.3,2150.25,2150.25,USD,"",2016-10-28,2016-10-27,"","Queen Mary, University of London","Pediatric Allergy and Immunology","CC BY","","",Wiley-Blackwell,2016,"Journal Article/Review",0,2016,"TRPA1 gene polymorphisms and childhood asthma"
2150.25,2150.25,2150.25,GBP,"",2016-11-11,2016-11-10,"",UCL,"NMR in Biomedicine","","","",Wiley-Blackwell,2016,"Journal Article/Review",0,"","Microstructure models for diffusion MRI in breast cancer and surrounding stroma: an ex vivo study"
"",2150.25,2150.25,GBP,"",2017-01-19,2017-01-19,"","University of Liverpool","Psycho-Oncology ","CC BY","","",Wiley-Blackwell,2016,"",1,"","How do Women at Increased Breast Cancer Risk Perceive and Decide Between Risks of Cancer and Risk-Reducing Treatments? A Synthesis of Qualitative Research"
2900,2146.9802,"",USD,"","",2016-12-12,1549-1277,"Cardiff University","PLOS Medicine","","","","Public Library of Science (PLoS)",2016,"Journal Article/Review",0,"","Patient safety incidents involving sick children in primary care in England and Wales: a mixed methods study"
2675,2146.33975,"",USD,"",2017-02-06,2017-02-06,"","University of Liverpool","Journal of Medical Internet Research","CC BY","","","JMIR Publications Inc.",2016,"",0,"","Exploring the Measurement Properties of the eHEALS eHealth Literacy Scale among Baby Boomers: A Multinational Test of Measurement Invariance "
"",2145.6,2145.6,"","","",2016-01-20,1364-5145,"Bangor University","Studies in Travel Writing","not yet published","","","Informa UK Limited",2016,"",1,"","Leisure, refuge and solidarity: messages in visitors’ books as microforms of travel writing"
"",2145.6,2145.6,GBP,"","",2016-12-21,"","Newcastle University","Annals of the American Association of Geographers","","","","Informa UK Limited",2016,"Journal Article/Review",0,"","Encountering misrecognition: being mistaken for being Muslim"
"",2145.6,2145.6,GBP,"",2016-12-16,2016-12-16,"","University of Liverpool",Biomarkers,"CC BY","","","Informa UK Limited",2016,"",1,"","A comparison of HMGB1 concentrations between cerebrospinal fluid and blood in patients with neurological disease"
"",2142,2142,"","",2016-11-13,2016-10-13,"","King's College London","Personalized Medicine ","","","","Future Medicine Ltd",2016,"",0,"","Emerging ethical perspectives in the CRISPR genome editing debate"
"",2142,2142,"","",2016-09-14,2016-09-08,"","University of Cambridge","Regenerative Medicine","","","","Future Medicine Ltd",2016,"",0,"","Cell therapies for Parkinsonâ€™s disease: how far have we come?"
"",2142,2142,GBP,"",2017-01-10,2017-01-10,"","University of Liverpool","Cell Death and Disease","CC BY","","","Springer Nature",2016,"",0,"","DRP-1 is required for BH3 mimetic-mediated mitochondrial fragmentation and apoptosis"
"",2142,2142,GBP,"",2017-01-19,2017-01-19,"","University of Liverpool","Current Medicinal Chemistry","CC BY","","","Future Medicine Ltd",2016,"",0,"","Pseudokinases: update on their functions and evaluation as new drug targets"
"",2137.67,2137.67,"","",2016-12-09,2016-10-26,"","King's College London","Psychological Medicine","","","","Cambridge University Press (CUP)",2016,"",0,""," Further evidence of a cumulative effect of social disadvantage on risk of psychosis."
"",2137.67,2137.67,"","",2016-12-09,2016-11-07,"","King's College London","Psychological Medicine","","","","Cambridge University Press (CUP)",2016,"",0,"","The efficacy of psychotherapy, pharmacotherapy and their combination on functioning and quality of life in depression: a meta-analysis."
2375,2137.63,2137.63,EUR,"",2016-10-12,2016-09-26,"",UCL,"Perspectives in Phycology","","","",Schweizerbart,2016,"Journal Article/Review",0,"","The biotechnological potential of Nannochloropsis"
"",2137.25,2137.25,"","",2016-10-30,2016-09-09,"","King's College London","Psychological Medicine","","","","Cambridge University Press (CUP)",2016,"",0,"","A novel resting-state functional MRI signature of resilience to recurrent depression"
"",2137.25,2137.25,"","",2016-11-03,2016-09-08,"","King's College London","Cardiology in the Young","","","","Cambridge University Press (CUP)",2016,"",0,"","The Neurodevelopmental Implications of Hypoplastic Left Heart Syndrome in the Fetus"
"",2136,2136,"","",2016-11-29,2016-11-08,1469-7807,"Imperial College London","Journal of Plasma Physics",NYP,"","","Cambridge University Press (CUP)",2016,"Journal Article/Review",0,"","Recent progress in astrophysical plasma turbulence from solar wind observations"
2563.2,2136,2136,USD,"",2016-10-13,2016-08-31,"","Queen Mary, University of London","Journal of Fluid Mechanics","","","","Cambridge University Press (CUP)",2016,"Journal Article/Review",0,2016,"Motion of a spherical capsule in branched tube flow with finite inertia"
"",2136,2136,"","","",2016-10-04,1360-6743,"University of Glasgow","English Language and Linguistics","","","","Cambridge University Press (CUP)",2016,"Journal Article/Review",0,2016,"The unstoppable glottal: tracking the development of an iconic British variable"
"",2136,2136,GBP,"",2017-01-10,2017-01-10,"","University of Liverpool","Epidemiology & Infection","CC BY","","","Cambridge University Press (CUP)",2016,"",0,"","Small ruminant pasteurellosis in Tigray region, Ethiopia: marked serotype diversity may affect vaccine efficacy"
"",2136,2136,GBP,"",2017-01-25,2017-01-25,"","University of Liverpool","Epidemiology & Infection","CC BY","","","Cambridge University Press (CUP)",2016,"",0,"","Small ruminant pasteurellosis in Tigray region, Ethiopia: marked serotype diversity may affect vaccine efficacy"
"",2136,2136,"","","","",0030-6053,"University of Oxford",Oryx,"","","","Cambridge University Press (CUP)",2016,"",0,"","Conserving a globally threatened species in a semi-natural, agrarian landscape"
2136,2136,2136,GBP,"",2016-08-01,2016-08-08,0025-7273,"University of York","Medical History","","","","Cambridge University Press (CUP)",2016,"Journal Article/Review",1,"","Policy Innovation and Policy Pathways: Tuberculosis Control in Sri Lanka, 1948-1990"
2125,2125,2125,GBP,"","","","","University of Oxford","American Journal of Epidemiology","","","","Oxford University Press (OUP)",2016,"",0,"","Time-varying differential misclassification is always possible, but highly unlikely"
"",2123.76,2123.76,"","",2016-07-04,2016-05-11,"","University of Cambridge","Acta Oecologica","","","","Elsevier BV",2016,"",0,"","Competition 1 can lead to unexpected patterns in tropical ant 2 communities"
2327.05,2123.22,2123.22,EUR,"",2016-11-01,2016-10-27,0960-894X,"Cardiff University","Bioorganic & Medicinal Chemistry Letters","","","","Elsevier BV",2016,"Journal Article/Review",0,"","ProTides of BVdU as Potential Anticancer Agents upon Efficient Intracellular Delivery of their Activated Metabolites"
2100,2100,2100,GBP,"",2016-10-24,2016-10-18,0951-631X,"Cardiff University","Social History of Medicine","","","","Oxford University Press (OUP)",2016,"Journal Article/Review",0,"","I should have thought that Wales was a wet part of the world’: Drought, rural communities and public health, 1870-1914"
2520,2100,2100,USD,"",2016-04-28,2016-01-28,"","Queen Mary, University of London","Molecular Ecology","CC BY","","",Wiley-Blackwell,2016,"Journal Article/Review",0,2016,"Unidirectional diploid-tetraploid introgression among British birch trees with shifting ranges shown by RAD markers"
2520,2100,2100,USD,"",2016-09-12,2016-09-01,"","Queen Mary, University of London","Prental Diagnosis","CC BY","","",Wiley-Blackwell,2016,"Journal Article/Review",0,2016,"Cx43 is overexpressed in human fetal membrane defects after fetoscopic surgery"
2100,2100,2100,GBP,"",2016-12-15,2016-01-08,"",UCL,"Clinical Science","","","","Biochemical Society",2016,"Journal Article/Review",0,"","Epigenetic regulation of cyclooxygenase-2 by methylation of c8orf4 in pulmonary fibrosis"
"",2100,2100,"","",2016-09-30,2016-07-12,"","University of Cambridge","IMA Journal of Applied Mathematics","","","","Oxford University Press (OUP)",2016,"",0,"","An Analytic Solution for Gust-Aerofoil Interaction Noise Including Effects of Geometry"
"",2100,2100,GBP,"",2017-01-13,2017-01-13,"","University of Liverpool","American Journal of Physical Anthropology","CC BY","","",Wiley-Blackwell,2016,"",0,"","Biomechanical implications of walking with indigenous footwear"
2100,2100,2100,GBP,"","","","","University of Oxford",Bioethics,"","","",Wiley-Blackwell,2016,"",0,"","Moral Hard-Wiring and Moral Enhancement"
"",2090.75,2090.75,"","","",2016-03-21,0013-7944,"University of Glasgow","Engineering Fracture Mechanics","CC BY","","","Elsevier BV",2016,"Journal Article/Review",0,2016,"Analysis of size effect on strength of quasi-brittle materials using integral-type nonlocal models"
"",2072.17,2072.17,"","",2016-11-22,2016-04-22,"","University of Cambridge","Journal of Archaeological Science","","","","Elsevier BV",2016,"",0,"","Approaching rice domestication in South Asia: new evidence from Indus settlements in northern India"
2327.05,2070.37,2070.37,EUR,"",2016-10-26,2016-10-03,"",UCL,Neuropsychologia,"","","","Elsevier BV",2016,"Journal Article/Review",0,"","Levodopa medication improves incidental sequence learning in Parkinson's disease"
2490,2048.6475,"",USD,"",2017-01-10,2017-01-10,"","University of Liverpool","Frontiers in Microbiology","CC BY","","","Frontiers Media SA",2016,"",0,"","Comparative transcriptomics reveals discrete survival responses of S. aureus and S. epidermidis to sapienic acid"
"",2048.04,2048.04,"","",2016-01-09,2015-10-14,"","University of Cambridge","Journal of Magnetic Resonance","","","","Elsevier BV",2016,"",0,"","Quantitative mapping of chemical compositions with MRI using compressed sensing"
"",2045.13,2045.13,"","","",2016-04-13,0022-5193,"University of Glasgow","Journal of Theoretical Biology","CC BY","","","Elsevier BV",2016,"Journal Article/Review",0,2016,"Modelling the effect of temperature on the seasonal population dynamics of temperate mosquitoes"
"",2040.98,2040.98,"","",2016-12-01,2016-09-09,"","University of Cambridge","Frontiers in Psychology","","","","Frontiers Media SA",2016,"",0,"","Does Executive Function Mediate the Relations Between Parental Behaviors and Childrenâ€™s Early Academic Ability?"
2394,2040.32,2040.32,EUR,"",2017-01-31,2016-12-05,2352-9350,"Northumbria University","Research Perspectives in International Water Law","CC BY","","","Brill Academic Publishers",2016,"Journal Article/Review",0,"","International Law Perspectives on Transboundary Governance  the Mekong River Basin – Can the Global Water Conventions Strengthen the 1995 Mekong Agreement?"
1700,2040,2040,GBP,"",2016-09-20,2016-06-06,0957-0233,"Cranfield University","Measurement Science and Technology","CC BY","","","IOP Publishing",2016,"Journal Article/Review",0,2016,"Development and application of optical fibre strain and pressure sensors for in-flight measurements "
"",2040,2040,GBP,"","",2016-12-15,"","Newcastle University","Journal of Physics Condensed Matter","","","","IOP Publishing",2016,"Journal Article/Review",0,"","Vortices and Vortex Lattices in Quantum Ferrofluids"
2040,2040,2040,USD,"",2016-04-28,2015-12-18,2040-8978,"Queen Mary, University of London","Journal of Optics","","","","IOP Publishing",2016,"Journal Article/Review",0,2016,"Isotropic and anisotropic surface wave cloaking techniques"
2040,2040,2040,USD,"",2016-09-15,2016-09-01,"","Queen Mary, University of London",Nonlinearity,"","","","IOP Publishing",2016,"Journal Article/Review",0,2016,"On the distribution of the maximum value of the characteristic polynomial of GUE random matrices"
2040,2040,2040,USD,"",2016-11-01,2016-09-12,"","Queen Mary, University of London","Journal of Optics","CC BY","","","IOP Publishing",2016,"Journal Article/Review",0,2016,"A coupling model for quasi-normal modes of photonic resonators"
2040,2040,2040,GBP,"",2016-08-18,2016-08-09,"",UCL,"Philosophical Transactions of the Royal Society B","CC BY","","","The Royal Society",2016,"Journal Article/Review",0,2016,"Gamete signalling underlies the evolution of mating types and their number"
2040,2040,2040,GBP,"",2016-10-27,2016-10-12,"",UCL,Interface,"","","","The Royal Society",2016,"Journal Article/Review",0,"","A new mechanism for spatial pattern formation via lateral and protrusion-mediated lateral signalling"
2040,2040,2040,GBP,"",2016-12-08,2016-11-29,"",UCL,"Proceedings of the Royal Society B","","","","The Royal Society",2016,"Journal Article/Review",0,"","Postcopulatory sexual selection influences baculum evolution in primates and carnivores"
"",2040,2040,"","",2016-01-19,2015-09-04,"","University of Cambridge","Superconductor Science and Technology","","","","IOP Publishing",2016,"",0,"","Magnetic levitation using high temperature superconducting pancake coils as composite bulk cylinders"
"",2040,2040,"","",2016-01-08,2015-11-16,"","University of Cambridge","Journal of Physics Condensed Matter","","","","IOP Publishing",2016,"",0,"","Influence of defects and domain walls on dielectric and mechanical resonances in LiNbO3"
"",2040,2040,"","","",2016-03-02,2040-8978,"University of Glasgow","Journal of Optics","CC BY","","","IOP Publishing",2016,"Journal Article/Review",0,2016,"Heralded phase-contrast imaging using an orbital angular momentum phase-filter"
"",2040,2040,"","","",2016-03-21,2040-8978,"University of Glasgow","Journal of Optics","CC BY","","","IOP Publishing",2016,"Journal Article/Review",0,2016,"On the natures of the spin and orbital parts of optical angular momentum"
"",2040,2040,"","","",2016-11-14,0022-3727,"University of Glasgow","Journal of Physics D: Applied Physics","","","","IOP Publishing",2016,"Journal Article/Review",0,2016,"Brillouin light scattering study of magnetic-element normal modes in a square artificial spin ice geometry"
"",2040,2040,GBP,"",2016-12-12,2016-12-12,"","University of Liverpool","Smart Materials and Structures","CC BY","","","IOP Publishing",2016,"",0,"","Robus structural damage detection and localization based on joint approximate diagonalization technique in frequency domain"
"",2040,2040,GBP,"",2016-12-16,2016-12-16,"","University of Liverpool","Superconducting Science & Technology","CC BY","","","IOP Publishing",2016,"",0,"","Non-perturbative measurement of low-intensity charged particle beams"
"",2040,2040,GBP,"",2016-12-20,2016-12-20,"","University of Liverpool","British Journal of Cancer","CC BY","","","Springer Nature",2016,"",0,"","Impact of disease stage and aetiology on survival inhepatocellular carcinoma implications for surveillance"
"",2040,2040,GBP,"",2016-12-20,2016-12-20,"","University of Liverpool","British Journal of Cancer","CC BY","","","Springer Nature",2016,"",0,"","Transarterial chemo-embolisation of hepatocelular carcinoma: impact of liver function and vascular invasion"
"",2039.16,2039.16,"","","",2016-07-01,1070-664X,"University of Glasgow","Physics of Plasmas","","","","AIP Publishing",2016,"Journal Article/Review",0,2016,"AlfvÃ©n ionization in an MHD-gas interactions code"
2500,2037.11,2037.11,USD,"",2016-10-19,2016-10-05,"",UCL,Geology,"","","","Geological Society of America",2016,"Journal Article/Review",0,"","Fault welding by pseudotachylyte formation"
"",2032.21,2032.21,"","",2016-07-06,2016-06-23,"","University of Cambridge","PLOS Neglected Tropical Diseases","","","","Public Library of Science (PLoS)",2016,"",0,"","The Anisakis transcriptome provides a resource for fundamental and applied studies on allergy-causing parasites"
"",2029.79,2029.79,"","","","",2334-2536,"University of Oxford",Optica,"","","","Optical Society of America",2016,"",0,"","A chip-based array of near-identical, pure, heralded single photon sources"
"",2010.52,2010.52,"","",2016-10-16,2016-09-05,"","King's College London","PLOS Computational Biology","","","","Public Library of Science (PLoS)",2016,"",0,"","SARAH Domain-mediated MST2-RASSF Dimeric Interactions"
2000,2008.03,2008.03,USD,"",2016-10-19,2016-10-07,0022-3077,"Cardiff University","Journal of Neurophysiology","","","","American Physiological Society",2016,"Journal Article/Review",0,"","Whisker row deprivation affects the flow of sensory information through rat barrel cortex"
"",2006.55,2006.55,"","",2016-11-11,2016-10-05,"","King's College London","Seizure: European Journal of Epilepsy","","","","Elsevier BV",2016,"",0,"","Ictal EEG source imaging in presurgical evaluation: high agreement between analysis methods "
2381.17,2002.52,2002.52,EUR,"",2016-12-09,2016-12-09,"","University of Liverpool","International Journal for Parasitology","CC BY","","","Elsevier BV",2016,"",0,"","Fasciola hepatica demonstrates high levels of genetic diversity, a lack of population structure and high gene flow: possible implications for drug resistance"
"",2000,2000,"","","","",0066-4812,"University of Oxford",Antipode,"","","",Wiley-Blackwell,2016,"",0,"","An informational right to the city? Code, content, control and the urbanization of information"
2458,1995.98,1995.98,USD,"",2016-11-28,2016-10-05,"",UCL,"Biomedical Optics Express","","","","Optical Society of America",2016,"Journal Article/Review",0,"","A New Multi-channel Broadband Near-Infrared Spectroscopy System to Measure the Spatial Distribution of Cellular Oxygen Metabolism and Tissue Oxygenation"
2490,1994.6643,"",USD,"",2017-02-14,2017-02-14,"","University of Liverpool","Frontiers in Pharmacology","CC BY","","","Frontiers Media SA",2016,"",0,"","Hexane extracts of Calophyllum brasiliense inhibit the development of gastric preneoplasia in Helicobacter felis infected INS-Gas mice"
2490,1993.9671,"",USD,"",2017-02-03,2017-02-03,"","University of Liverpool","Infectious Diseases","CC BY","","","Frontiers Media SA",2016,"",0,"","Characterization of the Prophage Repertoire of African Salmonella Typhimurium ST313 Reveals High Levels of Spontaneous Induction of Novel Phage BTP1"
2033,1993.66,1993.66,USD,"",2016-11-09,2016-10-28,"",UCL,"Journal of Medical Internet Research","","","","Journal of Medical Internet Research",2016,"Journal Article/Review",0,"","A Narrative Review Protocol to Assess Electronic Patient Platforms to Support Adolescents and Young Adults with Cancer"
"",1990.3,1990.3,"","",2016-07-08,2016-07-02,"","University of Cambridge",Virology,"","","","Elsevier BV",2016,"",0,"","A +1 ribosomal frameshifting motif prevalent among plant amalgaviruses"
2164.7,1989.25,1989.25,EUR,"",2016-11-03,2016-10-17,0140-1971,"Cardiff University","Journal of Adolescence","","","","Elsevier BV",2016,"Journal Article/Review",0,"","Brief report: Characteristics associated with risk taking behaviours predict young people's participation in organised activities."
1989,1989,1989,USD,"",2016-08-23,2016-08-24,"","Queen Mary, University of London",Gut,"CC BY","","",BMJ,2016,"Journal Article/Review",0,2016,"Ex vivo study of human visceral nociceptors"
1989,1989,1989,GBP,"",2016-10-12,2016-10-13,"",UCL,Heart,"","","",BMJ,2016,"Journal Article/Review",0,"","Coronary heart disease and risk factors as predictors of trajectories of psychological distress from midlife to old age"
1989,1989,1989,GBP,"",2016-11-03,2016-11-16,"",UCL,"Journal of Epidemiology and Community Health","","","",BMJ,2016,"Journal Article/Review",0,"","Relationship between employment histories and frailty trajectories in later life: evidence from the English Longitudinal Study of Ageing"
1989,1989,1989,GBP,"",2016-12-24,2016-11-25,"",UCL,"Journal of Epidemiology and Community Health","","","",BMJ,2016,"Journal Article/Review",0,"","Intergenerational social mobility and leisure-time physical activity in adulthood: a systematic review"
1989,1989,1989,GBP,"",2016-11-09,2016-11-09,"",UCL,"British Journal of Ophthalmology","","","",BMJ,2016,"Journal Article/Review",0,"","Retinitis Pigmentosa-associated Cystoid Macular Oedema: Pathogenesis and Avenues of Intervention"
1989,1989,1989,GBP,"",2016-11-20,2016-11-24,"",UCL,"Journal of Neurology, Neurosurgery and Psychiatry","","","",BMJ,2016,"Journal Article/Review",0,"","Subtle Motor Disturbances in PREDICT-PD Participants"
1989,1989,1989,GBP,"",2016-10-12,2016-10-14,"",UCL,Heart,"","","",BMJ,2016,"Journal Article/Review",0,"","Anti-inflammatory Treatment Improves  High-Density Lipoprotein Function in Rheumatoid Arthritis"
1989,1989,1989,GBP,"",2016-11-02,2016-11-02,"",UCL,"BMJ Quality & Safety","","","",BMJ,2016,"Journal Article/Review",0,"","What we know about designing an effective improvement intervention (but too often fail to put into practice)"
2332.35,1985.063085,"",EUR,"",2017-02-16,2017-02-16,"","University of Liverpool","Epilepsy and Behavior","CC BY","","","Elsevier BV",2016,"",0,"","Developing and assessing the acceptability of an epilepsy etc."
3420,1984.27,1984.27,USD,"",2016-07-04,2016-05-24,"","Queen Mary, University of London",Oncotarget,"CC BY","","","Impact Journals, LLC",2016,"Journal Article/Review",0,2016,"Independent Evaluation of a FOXM1-based Quantitative Malignancy Diagnostic System (qMIDS) on Head and Neck Squamous Cell Carcinomas"
2200,1982.48,1982.48,EUR,"",2016-10-19,2016-09-15,"",UCL,"Journal of Population Ageing","","","","Springer Nature",2016,"",0,"","Who in Europe Works beyond the State Pension Age and under which Conditions? Results from SHARE."
"",1957.2,1957.2,"","",2016-08-18,2016-08-11,"","University of Cambridge","Breast Cancer Research","","","","Springer Nature",2016,"",0,"","Imaging the mammary gland and mammary tumours in 3D: optical tissue clearing and immunofluorescence methods"
1938,1938,1938,GBP,"",2016-10-03,2016-09-15,"",UCL,"Genome Biology","","","","Springer Nature",2016,"Journal Article/Review",0,"","Correlation of an epigenetic mitotic clock with cancer risk"
2000,1934.08,1934.08,USD,"",2016-12-07,2016-11-09,"",UCL,"Journal of Biological Chemistry","","","","American Society for Biochemistry & Molecular Biology (ASBMB)",2016,"Journal Article/Review",0,"","Expansion of Lysine-rich Repeats in Plasmodium Proteins Generates Novel Localisation Sequences that Target the Periphery of the Host Erythrocyte"
