1377,1377,1377,GBP,"",2015-10-09,2015-10-13,2044-6055,"University of Bristol","BMJ Open","","","",BMJ,2015,"Journal Article/Review",0,"","Beyond height and weight: a programme of school nurse assessed skinfold measurements from 4 / 5 year old White British and South Asian origin children within the Born in Bradford cohort study"
"",1041.67,1041.67,USD,"",2015-10-30,2015-11-02,1932-4553,"University of Bristol","IEEE Journal of Selected Topics in Signal Processing","","","","Institute of Electrical and Electronics Engineers (IEEE)",2015,"Journal Article/Review",0,"","A Survey of Stochastic Simulation and Optimization Methods in Signal Processing"
"",1563.6,1563.6,USD,"",2015-12-07,2015-11-12,0002-9513,"University of Bristol","American Journal of Physiology","","","","American Physiological Society",2015,"Journal Article/Review",0,"","Altered Na/Ca exchange distribution and activity in ventricular myocytes from failing hearts"
"",1818.81,1818.81,EUR,"",2015-11-24,2015-11-20,0898-6568,"University of Bristol","Cellular Signalling","","","","Elsevier BV",2015,"Journal Article/Review",0,"","Insulin promotes Rip11 accumulation at the plasma membrane by inhibiting a dynamin- and PI3-kinase-dependent, but Akt-independent, internalisation event"
1530,1530,1530,GBP,"",2015-12-11,2015-11-23,0962-8452,"University of Bristol","Proceedings of the Royal Society B","","","","Royal Society Publishing",2015,"Journal Article/Review",0,"","Size isn’t everything: rates of genome size evolution, not C value, correlate with speciation in angiosperms"
"",1367.3,1367.3,EUR,"",2015-12-01,2015-11-23,0167-6296,"University of Bristol","Journal of Health Economics","","","","Elsevier BV",2015,"Journal Article/Review",0,"","Genetic Markers as Instrumental Variables"
"",1797.47,1797.47,EUR,"",2015-12-15,2015-12-03,1077-3142,"University of Bristol","Computer Vision and Image Understanding","","","","Elsevier BV",2015,"Journal Article/Review",0,"","A Comparative Study of Pose Representation and Dynamics Modelling  for Online Motion Quality Assessment"
1989,1989,1989,GBP,"",2015-12-06,2015-12-08,0022-2593,"University of Bristol","Journal of Medical Genetics","","","",BMJ,2015,"Journal Article/Review",0,"","A Study of Common Mendelian Disease Carriers across Ageing British Cohorts: Meta-analyses reveal Heterozygosity for Alpha 1-Antitrypsin Deficiency increases Respiratory Capacity and Height"
2700,2700,2700,GBP,"",2015-12-17,2015-12-15,1433-7851,"University of Bristol","Angewandte Chemie International Edition","","","",Wiley-Blackwell,2015,"Journal Article/Review",0,"","Refoldable foldamers: global conformational switching by deletion or insertion of a single hydrogen bond"
536.4,536.4,536.4,GBP,"",2015-12-22,2015-12-22,2158-2041,"University of Bristol","Contemporary Social Science","","","","Informa UK Limited",2015,"Journal Article/Review",0,"","How well can we predict educational outcomes? Examining the roles of cognitive ability and social position in educational attainment"
"",2040,2040,"","","",2014-10-02,"","University of Cambridge","Journal of Physics: Condensed Matter",Unknown,"","","IOP Publishing",2015,"",0,"","Strain relaxation mechanisms of elastic softening"
"",2087.12,2087.12,"","","",2015-10-08,"","University of Cambridge","Social Psychiatry and Psychiatric Epidemiology","","","","",2015,"",0,"","CHILDHOOD BEHAVIOUR PROBLEMS PREDICT CRIME AND VIOLENCE IN LATE ADOLESCENCE: BRAZILIAN AND BRITISH BIRTH COHORT STUDIES"
"",2040,2040,"","",2014-10-25,2014-10-11,"","University of Cambridge","Superconductor Science and Technology",Unknown,"","","IOP Publishing",2015,"",0,"","Effect of the size of GBCO-Ag secondary magnet on the static forces performance of linear synchronous motors"
"","","","","","",2014-10-14,"","University of Cambridge","Applied and Environmental Microbiology","","","","American Society for Microbiology",2015,"",0,"","Bacteriophage ?MAM1, a Viunalikevirus, Is a Broad-Host-Range, High-Efficiency Generalized Transducer That Infects Environmental and Clinical Isolates of the Enterobacterial Genera Serratia and Kluyvera"
"","","","","","",2014-10-20,"","University of Cambridge",Diabetes,"","","","",2015,"",1,"","Stimulation of glucagon-like peptide-1 secretion downstream of the ligand-gated ion channel TRPA1"
"",808.85,808.85,"","","",2014-10-28,"","University of Cambridge","Proceedings of the National Academy of Sciences (PNAS)",None,"","","",2015,"",0,"","DLK1/PREF1 regulates nutrient metabolism and protects from steatosis"
"","","","","","",2014-11-07,"","University of Cambridge",Diabetes,"","","","American Diabetes Association",2015,"",0,"","Clinical and molecular characterization of a novel PLIN1 frameshift mutation identified in patients with familial partial lipodystrophy"
"","","","","","",2014-11-12,"","University of Cambridge","BMC Public Health",Unknown,"","","Springer Nature",2015,"",0,"","The Medical Research Council Cognitive Function and Ageing Study"
"","","","","","",2014-11-14,"","University of Cambridge",Diabetes,"","","","",2015,"",0,"","Increased Dihydroceramide/ceramide ratio mediated by defective expression of degs1 impairs adipocyte differentiation and function"
"","","","","","",2014-11-14,"","University of Cambridge","EMBO Journal","","","","",2015,"",0,"","KSHV-TK is a tyrosine kinase that disrupts focal adhesions and induces Rho-mediated cell contraction"
"","","","","","",2014-11-14,"","University of Cambridge",Springer,"","","","",2015,"",0,"","Modeling the response of subglacial drainage at Paakitsoq, west Greenland, to 21st century climate change"
"",2120,2120,"","","",2014-11-27,"","University of Cambridge","European Journal of Epidemiology","","","","Springer Nature",2015,"",0,2014,"Mortality benefits of population-wide adherence to national physical activity guidelines: a prospective cohort study"
"","","","","","",2015-01-06,"","University of Cambridge","Communications in Statistics - Theory and Methods","","","","Informa UK Limited",2015,"",0,"","Estimating and contextualizing the attenuation of odds ratios due to non-collapsibility"
"","","","","","",2015-01-27,"","University of Cambridge","Journal of physics D: Applied Physics","","","","IOP Publishing",2015,"",0,"","Increase in Energy Product of Nanocomposite Magnets from Multiple Pulse Laser Annealing of Amorphous Melt Spun Nd-Fe-B Precursors"
"","","","","","",2015-02-04,"","University of Cambridge","Bulletin of the History of Medicine","","","","Johns Hopkins University Press",2015,"",0,"","Performative Rituals for Conception and Childbirth in England, 900-1500"
"","","","","","",2015-03-19,"DNA driven self-assembly of micron-sized rods using DNA-grafted bacteriophage fd virions","University of Cambridge",RSC,"","","","Royal Society of Chemistry (RSC)",2015,"",0,"","DNA driven self-assembly of micron-sized rods using DNA-grafted bacteriophage fd virions"
"",1891.66,1891.66,"","",2015-05-07,2015-03-20,"","University of Cambridge","Human Ecology: An Interdisciplinary Journal","","","","Springer Nature",2015,"",0,"","Dialogue between archaeology and humanitarian shelter: Resilience in pre-Columbian house-building and repair"
"","","","","","",2015-03-26,"Anne of Kiev (c.1024 Ð c.1075) and a reassessment of maternal power in the minority kingship of Philip I of France","University of Cambridge","Historical Research","","","",Wiley-Blackwell,2015,"",0,"","Anne of Kiev (c.1024 Ð c.1075) and a reassessment of maternal power in the minority kingship of Philip I of France"
"",1530,1530,"","",2015-07-09,2015-04-02,"","University of Cambridge","Philosophical Transactions of the Royal Society A: Mathematical, Physical and Engineering Sciences","","","","Royal Society Publishing",2015,"",0,"","The landscape of nonlinear structural dynamics: an Introduction"
"",536.4,536.4,"","",2015-07-16,2015-04-18,"","University of Cambridge","Journal of the American Statistical Association","","","","Informa UK Limited",2015,"",0,"","A functional approach to deconvolve dynamic neuroimaging data"
"","","","","","",2015-04-24,"","University of Cambridge","Journal of Geophysical Research","","","","",2015,"",0,"","The crustal structure of the western Himalayas and Tibet"
"","","","","","",2015-04-24,"Generation of reactive ketenes under flow conditions via Zinc mediated dehalogenation","University of Cambridge",Synlett,"","","","Thieme Publishing Group",2015,"",0,"","Generation of reactive ketenes under flow conditions via Zinc mediated dehalogenation"
"",1371.91,1371.91,"","",2015-05-21,2015-04-27,"","University of Cambridge","Journal of Anthropological Archaeology","","","","Elsevier BV",2015,"",0,"","The demography of the Upper Palaeolithic hunter-gatherers of Southwestern France: a multi-proxy approach using archaeological data"
"","","","","","",2015-04-28,"","University of Cambridge","Geochemistry, Geophysics, Geosystems","","","","",2015,"",0,"","Mantle plume capture, anchoring and outflow during Gal‡pagos plume-ridge interaction"
"",300,300,"","",2015-07-16,2015-04-30,"","University of Cambridge","Modern Languages Open",None,"","","Liverpool University Press",2015,"",0,"","From 'Olocausto' to Shoah: Naming Genocide in 21st-Century Italy"
"",2100,2100,"","","",2015-05-05,"","University of Cambridge","The English Historical Review",None,"","","Oxford University Press (OUP)",2015,"",0,"","Medical Practice, Urban Politics and Patronage: the London 'Commonalty' of Physicians and Surgeons of the 1420s"
"",540,540,"","",2015-05-21,2015-05-08,"","University of Cambridge","European Journal of Developmental Psychology","","","","Informa UK Limited",2015,"",0,"","The impact of contextual family risks on prisonersÕ childrenÕs behavioural outcomes and the potential protective role of family functioning moderators"
"",3780,3780,"","",2015-06-09,2015-05-14,"","University of Cambridge","Nature Communications","","","","Springer Nature",2015,"",0,"","Rare coding variants and X-linked loci associated with age at menarche"
"","","","","","",2015-05-18,"","University of Cambridge","Historical Research","","","",Wiley-Blackwell,2015,"",1,"","Memories of violence and New English identities in early modern Ireland"
"",2625.6,2625.6,"","",2015-05-29,2015-05-19,"","University of Cambridge","The Journal of Infectious Diseases","","","","Oxford University Press (OUP)",2015,"",0,"","Advances towards a norovirus antiviral: from classical inhibitors to lethal mutagenesis"
"",2040,2040,"","","",2015-05-28,"","University of Cambridge","BMJ Open Diabetes Research & Care","","","",BMJ,2015,"",0,"","Medication burden in the first five years following diagnosis of type 2 diabetes: findings from the ADDITION-UK trial cohort"
"","","","","","",2015-05-29,"","University of Cambridge","Journal of the American Ceramic Society","","","",Wiley-Blackwell,2015,"",0,"","The Compelling Case for Indentation as a Functional Exploratory and Characterization Tool"
"",2305.92,2305.92,"","","",2015-06-01,"","University of Cambridge","The Journal of Physiology","","","",Wiley-Blackwell,2015,"",0,"","Variations on fetal heart rate variability"
"",536.4,536.4,"","",2015-07-16,2015-06-05,"","University of Cambridge","Journal of Computational and Graphical Statistics","","","","Informa UK Limited",2015,"",0,"","Towards Automatic Model Selection: An adaptive sequential monte carlo approach"
"",3816.79,3816.79,"","","",2015-06-10,"","University of Cambridge","Cell Reports","","","","Elsevier BV",2015,"",0,2015,"APP Metabolism Regulates Tau Proteostasis in Human Cerebral Cortex Neurons"
"",1154.37,1154.37,"","","",2015-06-10,"","University of Cambridge","Diabetic Medicine","","","",Wiley-Blackwell,2015,"",0,"","Objectively measured sedentary time, physical activity and kidney function in people with recently diagnosed type 2 diabetes: a prospective cohort analysis"
"",1056.06,1056.06,"","",2015-06-11,2015-06-12,"The LMO2 -25 region harbours GATA2-dependent myeloid enhancer and RUNX-dependent T-lymphoid repressor activity","University of Cambridge","PLOS One","","","","Public Library of Science (PLoS)",2015,"",0,"","The LMO2 -25 region harbours GATA2-dependent myeloid enhancer and RUNX-dependent T-lymphoid repressor activity"
"",1200,1200,"","",2015-06-18,2015-06-17,"Comparison of single and combination diuretics on glucose tolerance (pathway-3) protocol for a randomised double-blind trial in patients with essential hypertension","University of Cambridge","BMJ Open","","","",BMJ,2015,"",0,"","Comparison of single and combination diuretics on glucose tolerance (pathway-3) protocol for a randomised double-blind trial in patients with essential hypertension"
"",2000,2000,"","","",2015-06-18,"","University of Cambridge","Journal of Antimicrobial Chemotherapy","","","","Oxford University Press (OUP)",2015,"",0,"","Early insights into the potential of the Oxford Nanopore MinION for antimicrobial resistance gene detection"
"",763.36,763.36,"","",2015-07-16,2015-06-19,"","University of Cambridge","American Mineralogist","","","","Mineralogical Society of America",2015,"",0,"","Elastic softening of leucite and the lack of polar domain boundaries"
"",2160.1,2160.1,"","",2015-07-28,2015-06-22,"","University of Cambridge","Chemistry - a European Journal","","","",Wiley-Blackwell,2015,"",0,"","Callipeltosides A, B & C: Total Syntheses and Structural Confirmation"
"","","","","","",2015-06-22,"Graphene and chiral nematic liquid crystals: a focus on lasing","University of Cambridge","RSC Advances","","","","Royal Society of Chemistry (RSC)",2015,"",0,"","Graphene and chiral nematic liquid crystals: a focus on lasing"
"",3778.63,3778.63,"","",2015-07-10,2015-06-22,"","University of Cambridge","Cell Host & Microbe","","","","Elsevier BV",2015,"",0,"","Myeloid growth factors promote resistance to mycobacterial infection by forestalling granuloma necrosis through macrophage replenishment"
"",2061.07,2061.07,"","",2015-06-29,2015-06-23,"","University of Cambridge","British Journal of Nutrition","","","","Cambridge University Press (CUP)",2015,"",0,"","The cross-sectional association between snacking behaviour and measures of adiposity: The Fenland Study, UK"
"",1440,1440,"","",2015-06-26,2015-06-23,"","University of Cambridge","Philosophical Transactions of the Royal Society B: Biological Sciences","","","","Royal Society Publishing ",2015,"",0,"","The impact of neuroscience on society: Cognitive enhancement in neuropsychiatric disorders and in healthy people"
"",536.4,536.4,"","","",2015-06-23,"","University of Cambridge","Race Ethnicity and Education","","","","Informa UK Limited",2015,"",0,"","Unfulfilled promises of equity: racism and interculturalism in Chilean Education"
"","","","","","",2015-06-23,"","University of Cambridge","Journal of Visualized Experiments","","","","MyJove Corporation",2015,"",0,"","Improved heterojunction quality in Cu2O-based solar cells through the optimization of atmospheric pressure spatial atomic layer deposited Zn1-xMgxO"
"","","","","","",2015-06-24,"","University of Cambridge","Journal of Visualized Experiments","","","","MyJove Corporation",2015,"",1,"","Assessment of maternal vascular remodeling during pregnancy in the mouse uterus"
"",3780,3780,"","",2015-07-15,2015-06-25,"","University of Cambridge","Nature Communications","","","","Springer Nature",2015,"",0,"","Transcriptional regulation of Annexin A2 promotes starvation-induced autophagy"
"",536.4,536.4,"","",2015-07-10,2015-06-29,"","University of Cambridge","Combustion Science and Technology","","","","Informa UK Limited",2015,"",0,"","DNS of complex fuel combustion with detailed chemistry: physical insight and mean reaction rate modelling"
"",1188,1188,"","",2015-07-13,2015-06-29,"","University of Cambridge","Scientific Reports","","","","Springer Nature",2015,"",0,"","Hydroxyproline Ring Pucker Causes Frustration of Helix Parameters in the Collagen Triple Helix"
"","","","","","",2015-06-29,"","University of Cambridge","IEEE Transactions on Nuclear Science","","","","Institute of Electrical and Electronics Engineers (IEEE)",2015,"",0,"","Combining MRI With PET for Partial Volume Correction Improves Image-Derived Input Functions in Mice"
"",2825.33,2825.33,"","","",2015-07-02,"","University of Cambridge","Current Opinion in Chemical Engineering","","","","Elsevier BV",2015,"",0,"","Automatic discovery and optimization of chemical processes"
"",1896.14,1896.14,"","","",2015-07-03,"","University of Cambridge",Psychopharmacology,"","","","Springer Nature",2015,"",0,"","Trial-unique, delayed nonmatching-to-location (TUNL) touchscreen testing for mice: Sensitivity to dorsal hippocampal dysfunction"
"",3780,3780,"","","",2015-07-03,"","University of Cambridge","Nature Communications","","","","Springer Nature",2015,"",0,"","Signature of magnetic-dependent gapless odd frequency states at superconductor / ferromagnet interfaces"
"",2474.39,2474.39,"","","",2015-07-06,"","University of Cambridge","Journal of Neurotrauma","","","","Mary Ann Liebert Inc",2015,"",0,"","Extracellular N-acetylaspartate in human traumatic brain injury"
"","","","","","",2015-07-06,"","University of Cambridge","Annals of Oncology","","","","Oxford University Press (OUP)",2015,"",0,"","Prospective study evaluating the relative sensitivity of 18F-NaF PET/CT for detecting skeletal metastases from renal cell carcinoma in comparison to multidetector CT and 99mTc-MDP bone scintigraphy, using an adaptive trial design."
"",3240,3240,"","","",2015-07-06,"","University of Cambridge",Neuropsychopharmacology,"","","","Springer Nature",2015,"",0,"","Biases in the explore-exploit tradeoff in addictions: the role of avoidance of uncertainty"
"",2317.2,2317.2,"","","",2015-07-06,"","University of Cambridge","Obesity Reviews","","","",Wiley-Blackwell,2015,"",0,"","Determinants of sugar-sweetened beverage consumption in young children: a systematic review"
"",2283.08,2283.08,"","","",2015-07-06,"","University of Cambridge","The International Journal of Biochemistry & Cell Biology","","","","Elsevier BV",2015,"",0,"","Functional roles of non-coding Y RNAs"
"",1890.54,1890.54,"","","",2015-07-07,"","University of Cambridge","Construction and Building Materials","","","","Elsevier BV",2015,"",0,"","Bond Behaviour of Reinforcing Bars in Cracked Concrete"
"",1559.4,1559.4,"","","",2015-07-07,"","University of Cambridge","Frontiers in Zoology","","","","Springer Nature",2015,"",0,"","The role of stripe orientation in target capture success"
"",770.12,770.12,"","","",2015-07-07,"","University of Cambridge",MAbs,"","","","Informa UK Limited",2015,"",0,"","Functionalised micro-capillary film for the rapid at-line analysis of IgG aggregates in a cell culture bioreactor"
"",2259.95,2259.95,"","","",2015-07-07,"","University of Cambridge","Journal of the American College of Cardiology: Heart Failure","","","","Elsevier BV",2015,"",0,"","Contribution of major lifestyle risk factors for incident heart failure in older adults: the Cardiovascular Health Study"
"",1049.54,1049.54,"","","",2015-07-08,"","University of Cambridge","AIP Advances","","","","AIP Publishing",2015,"",0,"","Reversible migration of silver on memorized pathways in Ag-Ge40S60 films"
"","","","","","",2015-07-08,"","University of Cambridge","Physical Chemistry Chemical Physics : PCCP","","","","Royal Society of Chemistry (RSC)",2015,"",0,"","Energy Landscapes of a Hairpin Peptide Including NMR Chemical Shift Restraints"
"","","","","","",2015-07-08,"","University of Cambridge","Advanced Functional Materials","","","",Wiley-Blackwell,2015,"",0,"","Fragile-to-Strong Crossover in Supercooled Liquid Ag-In-Sb-Te Studied by Ultrafast Calorimetry"
"",1618.51,1618.51,"","","",2015-07-09,"","University of Cambridge","BMJ Open","","","",BMJ,2015,"",0,"","Development of a universal approach to increase physical activity among adolescents: The GoActive Intervention"
"","","","","","",2015-07-09,"","University of Cambridge","Journal of Materials Processing Technology","","","","Elsevier BV",2015,"",0,"","Modelling and Visualisation of Material Flow in Friction Stir Spot Welding"
"",1902.71,1902.71,"","","",2015-07-10,"","University of Cambridge","Schizophrenia Research","","","","Elsevier BV",2015,"",0,"","Longitudinal regional brain volume loss in schizophrenia: relationship to antipsychotic medication and change in social function"
"",1546.49,1546.49,"","","",2015-07-10,"","University of Cambridge","Stem Cells","","","",Wiley-Blackwell,2015,"",0,"","Molecular mechanisms mediating retinal reactive gliosis following bone marrow mesenchymal stem cell (BM-MSC) transplantation"
"",2282.44,2282.44,"","","",2015-07-11,"","University of Cambridge","Earth and Planetary Science Letters","","","","Elsevier BV",2015,"",0,"","Fe-XANES analyses of Reykjanes Ridge basalts: Implications for oceanic crust's role in the solid Earth oxygen cycle"
"",1188,1188,"","","",2015-07-12,"","University of Cambridge","Scientific Reports","","","","Springer Nature",2015,"",0,"","An improved cucumber mosaic virus-based vector for efficient decoying of plant microRNAs"
"",1853.41,1853.41,"","","",2015-07-13,"","University of Cambridge","Contributions to Mineralogy and Petrology","","","","Springer Nature",2015,"",0,"","The evolution and storage of primitive melts in the Eastern Volcanic Zone of Iceland: the 10 ka GrÌ?msvÌ¦tn tephra series (i.e. the Saksunarvatn ash)"
"","","","","","",2015-07-13,"","University of Cambridge","Angewandte Chemie International Edition (English)","","","",Wiley-Blackwell,2015,"",0,"","Copper-Catalyzed Oxy-Alkenylation of Homoallylic Alcohols to Generate Functional syn-1,3-Diol Derivatives"
"","","","","","",2015-07-13,"","University of Cambridge","Angewandte Chemie International Edition (English)","","","",Wiley-Blackwell,2015,"",0,"","A concise and scalable strategy for the total synthesis of dictyodendrin B based on sequential C‰ÛÒH functionalization."
"",2698.87,2698.87,"","","",2015-07-14,"","University of Cambridge","British Journal of Dermatology","","","",Wiley-Blackwell,2015,"",0,"","p53 activity contributes to defective interfollicular epidermal differentiation, in hyperproliferative murine skin"
"",1554,1554,"","","",2015-07-14,"","University of Cambridge","Ecology and Evolution","","","",Wiley-Blackwell,2015,"",0,"","Conspicuous male coloration impairs survival against predators in Aegean wall lizards, Podarcis erhardii"
"","","","","","",2015-07-14,"","University of Cambridge","BMJ Open","","","",BMJ,2015,"",0,"","Predicting admissions and time spent in hospital over a decade in a population based record linkage study: the EPIC-Norfolk cohort"
"",776.29,776.29,"","","",2015-07-14,"","University of Cambridge","RNA Biology","","","","Informa UK Limited",2015,"",0,"","A Type III protein-RNA toxin-antitoxin system from Bacillus thuringiensis promotes plasmid retention during spore development"
"",1942.79,1942.79,"","","",2015-07-15,"","University of Cambridge","Journal of Colloid and Interface Science","","","","Elsevier BV",2015,"",0,"","The impact of trough geometry on film shape. A theoretical study of droplets containing polymer, for P-OLED display applications"
"","","","","","",2015-07-15,"","University of Cambridge","Annals of Behavioral Medicine","","","","Springer Nature",2015,"",0,"","Reliability of identification of behavior change techniques in intervention descriptions"
"","","","","","",2015-07-16,"","University of Cambridge","IEEE Transactions on Signal Processing","","","","Institute of Electrical and Electronics Engineers (IEEE)",2015,"",0,"","Unsupervised State-Space Modelling Using Reproducing Kernels"
"","","","","","",2015-07-17,"","University of Cambridge","Journal of Automated Reasoning","","","","Springer Nature",2015,"",0,"","The Higher-Order Prover Leo-II"
"",3071.61,3071.61,"","","",2015-07-17,"","University of Cambridge","Advanced Functional Materials","","","",Wiley-Blackwell,2015,"",0,"","Tuneable Singlet Exciton Fission and Triplet-Triplet Annihilation in an Orthogonal Pentacene Dimer"
"",1620,1620,"","","",2015-07-20,"","University of Cambridge","BMJ Open","","","",BMJ,2015,"",0,"","Older people, the natural environment and common mental disorders: cross-sectional results from the Cognitive Function and Ageing Study"
"",1457.4,1457.4,"","","",2015-07-20,"","University of Cambridge",Trials,"","","","Springer Nature",2015,"",0,"","Effectiveness of a behavioural intervention to prevent excessive weight gain during infancy (The Baby Milk Trial): study protocol for a randomised controlled trial"
"",2034,2034,"","","",2015-07-20,"","University of Cambridge","British Journal of Nutrition","","","","Cambridge University Press (CUP)",2015,"",0,"","Does the importance of dietary costs for fruit and vegetable intake vary by socioeconomic position"
"",2200,2200,"","","",2015-07-20,"","University of Cambridge","Applied Physics B","","","","Springer Nature",2015,"",0,"","High Spatial Resolution Laser Cavity Extinction and Laser Induced Incandescence in Low Soot Producing Flames"
"",1347.71,1347.71,"","","",2015-07-20,"","University of Cambridge","IEEE/OSA Journal of Display Technology","","","","Institute of Electrical and Electronics Engineers (IEEE)",2015,"",0,"","An approach to simultaneously test multiple devices for high-throughput production of thin-film electronics"
"",2254.07,2254.07,"","","",2015-07-21,"","University of Cambridge","Energy Policy","","","","Elsevier BV",2015,"",0,"","Land use implications of future energy system trajectories - the case of the UK 2050 Carbon Plan"
"","","","","","",2015-07-21,"","University of Cambridge","Current Opinion in Structural Biology","","","","Elsevier BV",2015,"",0,"","Enzyme engineering in biomimetic compartments"
"",1535.21,1535.21,"","","",2015-07-21,"","University of Cambridge","The Journal of Biological Chemistry","","","","American Society for Biochemistry & Molecular Biology (ASBMB)",2015,"",0,"","Modulation of Glucagon Receptor Pharmacology by RAMP2"
