2400,2400,2400,GBP,"",2014-09-19,"","",UCL,"Nutrition & Diabetes","","","","Springer Nature",2014,"",0,"","Modification of genetic influences on adiposity between 36-63 years of age by physical activity and smoking in the 1946 British birth cohort study"
2040,2040,2040,GBP,"",2014-09-19,"","",UCL,"British Journal of General Practice","","","","Royal College of General Practitioners",2014,"",0,"","Understanding quality improvement at scale in general practice: a qualitative study"
"","",2040,"","",2014-09-22,"","",UCL,"British Journal of General Practice","","","","Royal College of General Practitioners",2014,"",0,"","Help-seeking for cancer 'alarm' symptoms: a qualitative interview study"
3240,1979.21,1979.21,USD,"",2014-09-23,"","",UCL,"Epidemiology and Infection","","","","Cambridge University Press (CUP)",2014,"",0,"","Use of linked electronic health records to assess mortality and duration of stay associated with pandemic influenza A(H1N1)pdm09 at a UK teaching hospital"
1575,1008,1008,USD,"",2014-09-26,"","",UCL,"IEEE Wireless Communications Letters","","","","Institute of Electrical and Electronics Engineers (IEEE)",2014,"",0,"","Robust secrecy beamforming with energy-harvesting eavesdroppers"
1989,1989,1989,GBP,"",2014-09-29,"","",UCL,"Journal of Neurology, Neurosurgery & Psychiatry","","","",BMJ,2014,"",1,"","Selective peripheral denervation for cervical dystonia – long term follow-up"
"","",1384.98,"","",2014-09-29,"","",UCL,"Evolutionary Bioinformatics","","","","Libertas Academica",2014,"",1,"","SWAMP: Sliding Window Alignment Masker for PAML."
3235,2390.22,2390.22,USD,"",2014-09-30,"","",UCL,"Journal of Neuroscience","","","","Society for Neuroscience",2014,"",1,2014,"Relative valuation of pain in human orbitofrontal cortex"
1350,810,810,USD,"",2014-09-30,"","",UCL,"PLOS One","","","","Public Library of Science (PLoS)",2014,"",1,"","Defining disease phenotypes using national linked electronic health records: a case study of atrial fibrillation"
1347.78,1617.34,1617.34,GBP,"",2014-09-30,"","",UCL,"Journal of Applied Physics","","","","AIP Publishing",2014,"",1,"","The influence of surface functionalisation on the electrical properties and thermal stability of nanodiamonds"
2033,1251.13,1251.13,USD,"",2014-10-01,"","",UCL,"Journal of Medical Internet Research","","","","Journal of Medical Internet Research",2014,"",1,"","Non-probability web surveys to measure sexual behaviours and attitudes in the general population: a comparison with a probability sample interview survey"
2033,1254.01,1254.01,USD,"",2014-10-01,"","",UCL,"Journal of Medical Internet Research","","","","Journal of Medical Internet Research",2014,"",1,"","Seeking health information and support online – does it differ as a function of engagement in risky health behaviours? Evidence from the Health Information National Trends Survey"
1501.92,1501.92,1501.92,GBP,"",2014-10-03,"","",UCL,"Journal of Architecture","","","","Informa UK Limited",2014,"",1,"","Planning the Nation: the sanatorium movement in Germany"
1501.92,1501.92,1501.92,GBP,"",2014-10-03,"","",UCL,"Planning Theory & Practice","","","","Informa UK Limited",2014,"",1,"","The challenges of the “material turn” for planning studies"
3750,2349.56,2349.56,USD,"",2014-10-06,"","",UCL,"Bioconjugate Chemistry","","","","American Chemical Society (ACS)",2014,"",1,"","Homogeneous Bispecifics by Disulfide Bridging"
1870,1477.3,1477.3,EUR,"",2014-10-06,"","",UCL,"Attention, Perception, & Psychophysics","","","","Springer Nature",2014,"",1,"","Load-induced inattentional deafness"
1501.92,1501.92,1501.92,GBP,"",2014-10-06,"","",UCL,"Quarterly Journal of Experimental Psychology","","","","Informa UK Limited",2014,"",1,"","Strategic offloading of delayed intentions into the external environment"
2250,2250,2250,GBP,"",2014-10-07,"","",UCL,"Angewandte Chemie","","","",Wiley-Blackwell,2014,"",1,"","A Dual Color Far-Red to Near-Infrared Firefly Luciferin Analogue Designed for Multi-Parametric Bioluminescence Imaging"
3200,1969.32,1969.32,USD,"",2014-10-07,"","",UCL,"Tissue Engineering Part C: Methods","","","","Mary Ann Liebert Inc",2014,"",1,"","A Novel Method for Differentiation of Human Mesenchymal Stem Cells into Smooth Muscle-Like Cells on Clinically Deliverable TIPS Microspheres"
1525,938.5,938.5,USD,"",2014-10-07,"","",UCL,"RNA Biology","","","","Landes Bioscience",2014,"",1,"","Contributions of transcription and mRNA decay to gene expression dynamics of fission yeast in response to oxidative stress"
1500,1500,1500,GBP,"",2014-10-07,"","",UCL,"PROTEOMICS - Clinical Applications","","","",Wiley-Blackwell,2014,"",1,"","Discovery of serum biomarkers of ovarian cancer using complementary proteomic profiling strategies"
2400,2400,2400,GBP,"",2014-10-07,"","",UCL,Brain,"","","","Oxford University Press (OUP)",2014,"",1,"","Peripheral neuropathy predicts nuclear gene defect in patients with mitochondrial ophthalmoplegia"
2400,2400,2400,GBP,"",2014-10-07,"","",UCL,Brain,"","","","Oxford University Press (OUP)",2014,"",1,"","The first step in modern lesion-deficit analysis"
1884,1171.19,1171.19,USD,"",2014-10-08,"","",UCL,"Optics Letters","","","","Optical Society of America",2014,"",1,"","A continuous scanning mode for ptychography"
2520,2520,2520,GBP,"",2014-10-08,"","",UCL,"Journal of Human Hypertension","","","","Springer Nature",2014,"",1,"","Dose-response associations between cycling activity and risk of hypertension in regular cyclists: The UK Cycling for Health Study"
1501.92,1501.92,1501.92,GBP,"",2014-10-08,"","",UCL,"Terrorism and Political Violence","","","","Informa UK Limited",2014,"",1,"","The Battle for Baghdad: Testing Hypotheses About Insurgency From Risk Heterogeneity, Repeat Victimization, and Denial Policing Approaches"
1501.92,1501.92,1501.92,GBP,"",2014-10-08,"","",UCL,"Cartography and Geographic Information Science","","","","Informa UK Limited",2014,"",1,"","UK open source crime data: Accuracy and possibilities for research"
1501.92,1501.92,1501.92,GBP,"",2014-10-09,"","",UCL,"Technology Analysis & Strategic Management","","","","Informa UK Limited",2014,"",1,"","Exploring perceived control in domestic electricity demand side response"
584.2,584.2,584.2,GBP,"",2014-10-09,"","",UCL,"","","","","",2014,"",1,"","For details see existing DB records: 1) Inherited Prion Disease A117V … (Database record ID 3059); 2) A highly specific blood test for vCJD (Database record ID 3056)"
3235,2002.22,2002.22,USD,"",2014-10-09,"","",UCL,"Journal of Neuroscience","","","","Society for Neuroscience",2014,"",1,"","Gap Junctional Coupling is Essential for Epithelial Repair in the Avian Cochlea"
1519,940.14,940.14,USD,"",2014-10-09,"","",UCL,"Journal of Stem Cell Research & Therapy","","","","OMICS Publishing Group",2014,"",1,"","Receptor Kinase AXL Is Modulated in the Osteogenic Differentiation of Human Mesenchymal Stromal Cells on Modified Titanium Implant Surfaces"
1000,744.44,744.44,USD,"",2014-10-10,"","",UCL,"Proceedings of the National Academy of Sciences","","","","National Academy of Sciences",2014,"",1,"","Network histograms and universality of blockmodel approximation"
1849,1167.82,1167.82,USD,"",2014-10-10,"","",UCL,"Optics Express","","","","Optical Society of America",2014,"",1,"","Photonic generation for multichannel THz wireless communication"
1870,1477.3,1477.3,EUR,"",2014-10-11,"","",UCL,"Social Psychiatry and Psychiatric Epidemiology","","","","Springer Nature",2014,"",1,"","Mood as a mediator of the link between child sexual abuse and psychosis"
1501.92,1501.92,1501.92,GBP,"",2014-10-13,"","",UCL,"Technology Analysis & Strategic Management","","","","Informa UK Limited",2014,"",1,"","A qualitative study of perspectives on household and societal impacts of demand response"
1500,1500,1500,GBP,"",2014-10-13,"","",UCL,"Journal of Flood Risk Management","","","",Wiley-Blackwell,2014,"",1,"","Household measures for river flood risk reduction in the Czech Republic"
1250,680.95,680.95,AUD,"",2014-10-14,"","",UCL,"Journal of Cancer","","","",Ivyspring,2014,"",1,"","Amplification of chromosome 1q genes encoding the phosphoinositide signalling enzymes PI4KB, AKT3, PIP5K1A and PI3KC2B in breast cancer"
4000,2488.61,2488.61,USD,"",2014-10-14,"","",UCL,"Crystal Growth & Design","","","","American Chemical Society (ACS)",2014,"",1,"","An investigation into the dehydration behavior of paroxetine HCl form I using a combination of thermal and diffraction methods: the identification and characterization of a new anhydrous form"
2897.31,2897.31,2897.31,GBP,"",2014-10-14,"","",UCL,"Lancet Global Health","","","","Elsevier BV",2014,"",1,"","Antenatal multiple micronutrient supplementation does not result in a difference in anthropometry and blood pressure in mid-childhood: follow-up of a double-blind randomized controlled trial in Nepal"
1296,1296,1296,GBP,"",2014-10-14,"","",UCL,"Proceedings of the Royal Society B","","","","The Royal Society",2014,"",1,"","Evolution of Cultural Traits Occurs at Similar Relative Rates in Different World Regions"
"","",683.61,"","",2014-10-14,"","",UCL,"Optics Express","","","","Optical Society of America",2014,"",1,"","High temperature operation of athermal widely tuneable laser with simplified wavelength control for WDM-PON systems"
2400,2400,2400,GBP,"",2014-10-14,"","",UCL,Brain,"","","","Oxford University Press (OUP)",2014,"",1,"","Prominent effects and neural correlates of visual crowding in a neurodegenerative disease population"
3600,3600,3600,GBP,"",2014-10-14,"","",UCL,"International Innovation","","","","Research Media",2014,"",1,"","Startle Disease (Hyperekplexia): glycine 2"
3800,2544.18,2544.18,USD,"",2014-10-15,"","",UCL,AIDS,"","","","Wolters Kluwer / Lippincott, Williams and Wilkins",2014,"",1,"","Impact on life expectancy of HIV-1 positive individuals of CD4R cell count and viral load response to antiretroviral therapy"
2200,2100.68,2100.68,EUR,"",2014-10-15,"","",UCL,"Journal of Clinical Monitoring and Computing","","","","Springer Nature",2014,"",1,"","The accuracy of respiratory rate assessment by doctors in a London teaching hospital: a cross-sectional study"
225,225,225,GBP,"",2014-10-15,"","",UCL,Opticon1826,"","","","Ubiquity Press, Ltd.",2014,"",1,"","The View From The Traveller Site: Post-Nomadic Subjects and the Material Relations of Permanent Temporary Dwelling"
900,721.72,721.72,EUR,"",2014-10-16,"","",UCL,"Journal of Pediatric Genetics","","","","IOS Press",2014,"",1,"","Clinical genetics and pathobiology of ciliary chondrodysplasias"
3780,3780,3780,GBP,"",2014-10-16,"","",UCL,"Nature Communications","","","","Springer Nature",2014,"",1,"","Deficient Wnt signaling triggers striatal synaptic degeneration and impaired motor behavior in adult mice"
1700,1700,1700,GBP,"",2014-10-17,"","",UCL,"Journal of Physics B: Atomic, Molecular & Optical Physics","","","","IOP Publishing",2014,"",1,"","R-Matrix calculations of low-energy electron collisions with Methane"
3235,2010.5,2010.5,USD,"",2014-10-20,"","",UCL,"Journal of Neuroscience","","","","Society for Neuroscience",2014,"",1,"","Effect of human auditory efferent feedback on cochlear gain and compression"
1740,1740,1740,GBP,"",2014-10-20,"","",UCL,"Molecular Biology and Evolution","","","","Oxford University Press (OUP)",2014,"",1,"","Unguided species delimitation using DNA sequence data from multiple loci"
1870,1477.3,1477.3,EUR,"",2014-10-21,"","",UCL,Diabetologia,"","","","Springer Nature",2014,"",1,"","A dysglycaemic effect of statins in diabetes: relevance to clinical practice?"
1500,1500,1500,GBP,"",2014-10-21,"","",UCL,"Methods in Ecology and Evolution","","","",Wiley-Blackwell,2014,"",1,"","A method to detect sub-communities from multivariate spatial associations"
700,433.29,433.29,USD,"",2014-10-21,"","",UCL,"","","","","Association for Computing Machinery (ACM)",2014,"Conference Paper/Proceeding/Abstract",1,"","MIDAS: Empowering 802.11ac Networks with Multiple-Input Distributed Antenna Systems"
1500,1500,1500,GBP,"",2014-10-21,"","",UCL,"Polymer International","","","",Wiley-Blackwell,2014,"",1,"","Preparation of polymeric nanoparticles by novel electrospray nanoprecipitation"
1501.92,1501.92,1501.92,GBP,"",2014-10-21,"","",UCL,"Journal of Urban Design","","","","Informa UK Limited",2014,"",1,"","The extended workplace in a creative cluster: exploring space(s) of digital work in Silicon Roundabout"
4000,2482.75,2482.75,USD,"",2014-10-22,"","",UCL,"Journal of Physical Chemistry C","","","","American Chemical Society (ACS)",2014,"",1,"","A Density Functional Theory Study of the Adsorption of Hydrazine on the Perfect and Defective Copper (100), (110) and (111) Surfaces"
3235,2002.43,2002.43,USD,"",2014-10-22,"","",UCL,"Journal of Neuroscience","","","","Society for Neuroscience",2014,"",1,"","Cholinergic stimulation enhances Bayesian belief updating in the deployment of spatial attention"
1000,621.48,621.48,USD,"",2014-10-22,"","",UCL,"Proceedings of the National Academy of Sciences","","","","National Academy of Sciences",2014,"",1,"","Cross-modal effects of value on perceptual acuity and stimulus encoding"
2029,1260.99,1260.99,USD,"",2014-10-22,"","",UCL,"Optics Express","","","","Optical Society of America",2014,"",1,"","On the origin of contrast in edge illumination X-ray phase-contrast imaging"
3800,2361.64,2361.64,USD,"",2014-10-22,"","",UCL,Neurology,"","","","Wolters Kluwer / Lippincott, Williams and Wilkins",2014,"",1,"","Preventing visual field deficits from neurosurgery"
3800,2361.64,2361.64,USD,"",2014-10-22,"","",UCL,"Journal of Hypertension","","","","Wolters Kluwer / Lippincott, Williams and Wilkins",2014,"",1,"","Symptoms Of Anxiety And Depression Across Adulthood And Blood Pressure In Late Middle Age: The 1946 British Birth Cohort"
2200,1375.95,1375.95,USD,"",2014-10-22,"","",UCL,"Journal of Chemical Physics","","","","AIP Publishing",2014,"",1,"","Water on BN doped benzene: A hard test for exchange-correlation functionals and the impact of exact exchange on weak binding"
225,225,225,GBP,"",2014-10-23,"","",UCL,"Archaeology International","","","","Ubiquity Press, Ltd.",2014,"",1,2014,"Scaling the State: Egypt in the Third Millennium"
225,225,225,GBP,"",2014-10-23,"","",UCL,"Archaeology International","","","","Ubiquity Press, Ltd.",2014,"",1,"","Amazonian Dark Earths in Western Amazonia?"
900,560.86,560.86,USD,"",2014-10-23,"","",UCL,"","","","","Association for Computing Machinery (ACM)",2014,"Conference Paper/Proceeding/Abstract",1,"","Bi-Modal Detection of Painful Reaching for Chronic Pain Rehabilitation Systems"
225,225,225,GBP,"",2014-10-23,"","",UCL,"Archaeology International","","","","Ubiquity Press, Ltd.",2014,"",1,"","Crowd-sourced archaeological research: the MicroPasts Project"
225,225,225,GBP,"",2014-10-23,"","",UCL,"Archaeology International","","","","Ubiquity Press, Ltd.",2014,"",1,"","Microscopic Rocks and Expansive Empires: Investigating Inca Ceramics from Cuzco, Peru"
225,225,225,GBP,"",2014-10-23,"","",UCL,"Archaeology International","","","","Ubiquity Press, Ltd.",2014,"",1,"","Pattern in Glass Use in the Roman and Byzantine worlds: A Report on Current Research at the Institute of Archaeology and UCL Qatar"
225,225,225,GBP,"",2014-10-23,"","",UCL,"Archaeology International","","","","Ubiquity Press, Ltd.",2014,"",1,"","The Naukratis Project: Petrie, Greeks and Egyptians"
1500,1500,1500,GBP,"",2014-10-24,"","",UCL,"Visual Anthropology Review","","","",Wiley-Blackwell,2014,"",1,"","Drawing it out"
1500,1500,1500,GBP,"",2014-10-24,"","",UCL,"Journal of Biomedical Materials Research","","","",Wiley-Blackwell,2014,"",1,"","TiO2 coated CoCrMo; Improving the osteogenic differentiation and adhesion of mesenchymal stem cells in vitro"
240,240,240,GBP,"",2014-10-25,"","",UCL,"Clinical Risk","","","","SAGE Publications",2014,"",1,"","Patient safety and interactive medical devices: Realigning work as imagined and work as done"
240,240,240,GBP,"",2014-10-25,"","",UCL,"Administrative Science Quarterly","","","","SAGE Publications",2014,"",1,"","Using negotiated joining to construct and fill open-ended roles in elite culinary groups"
2400,2400,2400,GBP,"",2014-10-27,"","",UCL,Brain,"","","","Oxford University Press (OUP)",2014,"",0,"","Temporal lobe surgery in childhood and neuroanatomical predictors of long-term declarative memory outcome"
2000,1491.76,1491.76,USD,"",2014-10-27,"","",UCL,"Journal of Physical Chemistry C","","","","American Chemical Society (ACS)",2014,"",1,"","The nature of molybdenum surface in iron molybdate: the active phase in selective methanol"
2100,2100,2100,GBP,"",2014-10-27,"","",UCL,"Human Molecular Genetics","","","","Oxford University Press (OUP)",2014,"",1,"","Translational read-through of the RP2 Arg120stop mutation in patient iPSC-derived retinal pigment epithelial cells"
225,225,225,GBP,"",2014-10-27,"","",UCL,"Papers from the Institute of Archaeology","","","","Ubiquity Press, Ltd.",2014,"",1,"","Were-Jaguars and crocodilians: a need to redefine"
225,225,225,GBP,"",2014-10-28,"","",UCL,Opticon1826,"","","","Ubiquity Press, Ltd.",2014,"",1,"","Surrealism in André Breton's Nadja"
3235,2407.62,2407.62,USD,"",2014-10-28,"","",UCL,"Journal of Neuroscience","","","","Society for Neuroscience",2014,"",1,"","The importance of premotor cortex for supporting speech production after left capsular-putaminal damage"
1500,1500,1500,GBP,"",2014-10-28,"","",UCL,"Seminars In Dialysis","","","",Wiley-Blackwell,2014,"",1,"","Will incremental haemodialysis preserve residual function and improve patient survival?"
3235,2006.35,2006.35,USD,"",2014-10-29,"","",UCL,"Journal of Neuroscience","","","","Society for Neuroscience",2014,"",1,"","Attentional modulation of alpha-/beta- and gamma-oscillations reflect functionally distinct processes"
2034,2034,2034,GBP,"",2014-10-29,"","",UCL,"Psychological Medicine","","","","Cambridge University Press (CUP)",2014,"",1,"","Cost-effectiveness of electroconvulsive therapy compared to repetitive transcranial magnetic stimulation for treatment-resistant severe depression: a decision model"
1500,1500,1500,GBP,"",2014-10-29,"","",UCL,"Advanced Materials","","","",Wiley-Blackwell,2014,"",0,"","Interlayer cation exchange stabilizes polar perovskite surfaces"
1575,1008,1008,USD,"",2014-10-29,"","",UCL,"IEEE Proceedings","","","","Institute of Electrical and Electronics Engineers (IEEE)",2014,"",1,"","Radar spectrum engineering and management: technical and regulatory issues"
2250,2250,2250,GBP,"",2014-10-30,"","",UCL,"Journals of Gerontology: Series B","","","","Oxford University Press (OUP)",2014,"",1,"","Aging and functional health literacy: a systematic review and meta-analysis"
2040,2040,2040,GBP,"",2014-10-30,"","",UCL,"Cardiovascular Research","","","","Oxford University Press (OUP)",2014,"",1,"","ESC Working Group Cellular Biology of the Heart: Position Paper: Improving the pre-clinical assessment of novel cardioprotective therapies"
2100,2100,2100,GBP,"",2014-10-30,"","",UCL,"European Journal of Cardio-Thoracic Surgery","","","","Oxford University Press (OUP)",2014,"",1,"","Histology of a Marfan aorta four and a half years after personalised external aortic mesh support (PEARS)"
3360,3360,3360,GBP,"",2014-11-01,"","",UCL,"International Journal of Obesity","","","","Springer Nature",2014,"",1,"","Race/Ethnic Disparities in Early Childhood BMI, Obesity and Overweight in the UK and US"
2100,2100,2100,GBP,"",2014-11-03,"","",UCL,"European Journal of International Law","","","","Oxford University Press (OUP)",2014,"",1,"","Equality in Global Commerce: Towards a Political Theory of International Economic Law"
1125,1125,1125,GBP,"",2014-11-03,"","",UCL,"Geophysical Research Letters","","","",Wiley-Blackwell,2014,"",1,"","On Mars too, expect macroweather"
2200,2083.82,2083.82,EUR,"",2014-11-03,"","",UCL,"Journal of Inherited Metabolic Disease","","","","Springer Nature",2014,"",1,"","White matter microstructure pathology in classic galactosemia revealed by neurite orientation dispersion and density imaging"
1920,1920,1920,GBP,"",2014-11-04,"","",UCL,"Security Journal","","","","Palgrave Macmillan",2014,"",1,"","The when and where of an emerging crime type: The example of metal theft from the railway network of Great Britain"
1150,899.26,899.26,EUR,"",2014-11-05,"","",UCL,"Annales Geophysicae","","","",Copernicus,2014,"",1,"","Cluster Observations of the Substructure of a Flux Transfer Event: Analysis of High-Time Resolution Particle Datag"
3260,2037.12,2037.12,USD,"",2014-11-05,"","",UCL,"Journal of Neuroscience","","","","Society for Neuroscience",2014,"",1,"","Cortical state determines global variability and correlations in visual cortex"
2034,2034,2034,GBP,"",2014-11-05,"","",UCL,Oryx,"","","","Cambridge University Press (CUP)",2014,"",1,"","Development of the Chinese giant salamander (Andrias davidianus) farming industry in Shaanxi Province Development of the Chinese giant salamander (Andrias davidianus) farming industry in Shaanxi Province, China: conservation threats and opportunities"
1250,773.65,773.65,USD,"",2014-11-05,"","",UCL,"Neural Computation","","","","MIT Press - Journals",2014,"",1,"","High-Dimensional Cluster Analysis with the Masked EM Algorithm"
1365.88,1365.88,1365.88,GBP,"",2014-11-05,"","",UCL,"Journal of Applied Physics","","","","AIP Publishing",2014,"",1,"","Homeotropic alignment and fret: the way to a brighter luminescent solar concentrator"
1059.28,1059.28,1059.28,GBP,"",2014-11-05,"","",UCL,"Physical Review B","","","","American Physical Society (APS)",2014,"",1,"","Many-body effects in a quasi-one-dimensional electron gas"
1900,1187.28,1187.28,USD,"",2014-11-05,"","",UCL,"Journal of Medical Internet Research","","","","Journal of Medical Internet Research",2014,"",1,"","Preliminary evaluation of SF28 – a mobile application to aid smoking cessation"
2200,1374.74,1374.74,USD,"",2014-11-05,"","",UCL,"Applied Physics Letters","","","","AIP Publishing",2014,"",1,"","Virtually-pure near-infrared electroluminescence from exciplexes at polyfluorene / hexaazatrinaphthylene interfaces"
1989,1989,1989,GBP,"",2014-11-06,"","",UCL,"Journal of Epidemiology & Community Health","","","",BMJ,2014,"",1,"","Childhood Conscientiousness predicts the Social Gradient of Smoking in Adulthood: A Life Course Analysis"
1800,1800,1800,GBP,"",2014-11-07,"","",UCL,"Biochemical Journal","","","","Biochemical Society",2014,"",1,"","Comparisons of subunit 5A and 5B isozymes of yeast cytochrome c oxidase"
1989,1989,1989,GBP,"",2014-11-07,"","",UCL,"Archives of Disease in Childhood","","","",BMJ,2014,"",1,"","The unseen child and safeguarding: Did Not Attend (DNA) guidelines in English NHS organisations"
2400,2400,2400,GBP,"",2014-11-07,"","",UCL,"European Respiratory Journal","","","","European Respiratory Society",2014,"",0,"","Use of FVC and FEV1 quality criteria for determining a valid test"
1989,1989,1989,GBP,"",2014-11-09,"","",UCL,"Journal of Epidemiology & Community Health","","","",BMJ,2014,"",1,"","The effect of participatory women’s groups on infant feeding and child health knowledge, behaviour and outcomes in rural Bangladesh: a controlled before-and-after study"
2550,2550,2550,GBP,"",2014-11-10,"","",UCL,"Journals of Gerontology: Series A","","","","Oxford University Press (OUP)",2014,"",1,"","“Skeletal muscle function deficit” in a nationally representative British birth cohort in early old age"
2100,2100,2100,GBP,"",2014-11-10,"","",UCL,"International Journal of Epidemiology","","","","Oxford University Press (OUP)",2014,"",1,"","COHORT PROFILE: Sympathetic activity and Ambulatory Blood Pressure in Africans (SABPA) Prospective Cohort Study"
2550,2550,2550,GBP,"",2014-11-10,"","",UCL,"Cerebral Cortex","","","","Oxford University Press (OUP)",2014,"",1,"","Constructing, perceiving and maintaining scenes: Hippocampal activity and connectivity"
2975.75,2975.75,2975.75,GBP,"",2014-11-10,"","",UCL,"Lancet Psychiatry","","","","Elsevier BV",2014,"",0,"","Long-term clinical and cost-effectiveness of START (STrAtegies for RelaTives) psychological intervention for family carers and the effects on cost of care for people with dementia: a randomised controlled trial"
1260,1260,1260,GBP,"",2014-11-10,"","",UCL,"Proceedings of the Royal Society A","","","","The Royal Society",2014,"",0,"","Mapping the landscape of climate engineering"
3024,3024,3024,GBP,"",2014-11-10,"","",UCL,"International Journal of Obesity","","","","Springer Nature",2014,"",0,"","Perceived weight discrimination in England: a population-based study of adults aged 50 and older"
1989,1989,1989,GBP,"",2014-11-10,"","",UCL,"Journal of Neurology, Neurosurgery & Psychiatry","","","",BMJ,2014,"",0,"","Using Reaction Time and Co-contraction to Differentiate Acquired (Secondary) from Functional “Fixed” Dystonia"
1500,1500,1500,GBP,"",2014-11-11,"","",UCL,"Acta Paediatrica","","","",Wiley-Blackwell,2014,"",0,"","Assessing pubertal status in multi-ethnic primary school children"
1989,1989,1989,GBP,"",2014-11-11,"","",UCL,Heart,"","","",BMJ,2014,"",0,"","Cardiovascular risk profile and frailty in a population-based study of older British men"
1971.9,1606,1606,EUR,"",2014-11-11,"","",UCL,"Science & Justice","","","","Elsevier BV",2014,"",0,"","Choice of population database for forensic DNA profile analysis"
525,525,525,GBP,"",2014-11-11,"","",UCL,mAbs,"","","","Informa UK Limited",2014,"",0,"","Continuous bioprocessing: the real thing this time?"
1500,1500,1500,GBP,"",2014-11-11,"","",UCL,"Annals of the New York Academy of Sciences","","","",Wiley-Blackwell,2014,"",0,"","Functional MRI of music emotion processing in frontotemporal dementia"
1501.92,1501.92,1501.92,GBP,"",2014-11-11,"","",UCL,"Psychology & Health","","","","Informa UK Limited",2014,"",0,"","Longitudinal associations between social connections and subjective wellbeing in the English Longitudinal Study of Ageing"
